problem_statement,titleslug,title,tags,num_occur
"A message containing letters from A-Z can be encoded into numbers using the following mapping:  'A' -> ""1"" 'B' -> ""2"" ... 'Z' -> ""26""  To decode an encoded message, all the digits must be grouped then mapped back into letters using the reverse of the mapping above (there may be multiple ways). For example, ""11106"" can be mapped into:  ""AAJF"" with the grouping (1 1 10 6) ""KJF"" with the grouping (11 10 6)  Note that the grouping (1 11 06) is invalid because ""06"" cannot be mapped into 'F' since ""6"" is different from ""06"". Given a string s containing only digits, return the number of ways to decode it. The test cases are generated so that the answer fits in a 32-bit integer.  ",decode-ways,Decode Ways,"String, Dynamic Programming",9
"Given a non-negative integer x, return the square root of x rounded down to the nearest integer. The returned integer should be non-negative as well. You must not use any built-in exponent function or operator.  For example, do not use pow(x, 0.5) in c++ or x ** 0.5 in python.   ",sqrtx,Sqrt(x),"Math, Binary Search",9
"Implement pow(x, n), which calculates x raised to the power n (i.e., xn).  ",powx-n,"Pow(x, n)","Math, Recursion",9
"Given an array nums of distinct integers, return all the possible permutations. You can return the answer in any order.  ",permutations,Permutations,"Array, Backtracking",9
"Given a sorted array of distinct integers and a target value, return the index if the target is found. If not, return the index where it would be if it were inserted in order. You must write an algorithm with O(log n) runtime complexity.  ",search-insert-position,Search Insert Position,"Array, Binary Search",9
"Given a string containing just the characters '(' and ')', return the length of the longest valid (well-formed) parentheses substring.  ",longest-valid-parentheses,Longest Valid Parentheses,"String, Dynamic Programming, Stack",9
"Given two integers dividend and divisor, divide two integers without using multiplication, division, and mod operator. The integer division should truncate toward zero, which means losing its fractional part. For example, 8.345 would be truncated to 8, and -2.7335 would be truncated to -2. Return the quotient after dividing dividend by divisor. Note: Assume we are dealing with an environment that could only store integers within the 32-bit signed integer range: [−231, 231 − 1]. For this problem, if the quotient is strictly greater than 231 - 1, then return 231 - 1, and if the quotient is strictly less than -231, then return -231.  ",divide-two-integers,Divide Two Integers,"Math, Bit Manipulation",9
"Given an integer array nums sorted in non-decreasing order, remove the duplicates in-place such that each unique element appears only once. The relative order of the elements should be kept the same. Then return the number of unique elements in nums. Consider the number of unique elements of nums be k, to get accepted, you need to do the following things:  Change the array nums such that the first k elements of nums contain the unique elements in the order they were present in nums initially. The remaining elements of nums are not important as well as the size of nums. Return k.  Custom Judge: The judge will test your solution with the following code:  int[] nums = [...]; // Input array int[] expectedNums = [...]; // The expected answer with correct length  int k = removeDuplicates(nums); // Calls your implementation  assert k == expectedNums.length; for (int i = 0; i < k; i++) {     assert nums[i] == expectedNums[i]; }  If all assertions pass, then your solution will be accepted.  ",remove-duplicates-from-sorted-array,Remove Duplicates from Sorted Array,"Array, Two Pointers",9
"Write a function to find the longest common prefix string amongst an array of strings. If there is no common prefix, return an empty string """".  ",longest-common-prefix,Longest Common Prefix,"String, Trie",9
"Implement the myAtoi(string s) function, which converts a string to a 32-bit signed integer (similar to C/C++'s atoi function). The algorithm for myAtoi(string s) is as follows:  Read in and ignore any leading whitespace. Check if the next character (if not already at the end of the string) is '-' or '+'. Read this character in if it is either. This determines if the final result is negative or positive respectively. Assume the result is positive if neither is present. Read in next the characters until the next non-digit character or the end of the input is reached. The rest of the string is ignored. Convert these digits into an integer (i.e. ""123"" -> 123, ""0032"" -> 32). If no digits were read, then the integer is 0. Change the sign as necessary (from step 2). If the integer is out of the 32-bit signed integer range [-231, 231 - 1], then clamp the integer so that it remains in the range. Specifically, integers less than -231 should be clamped to -231, and integers greater than 231 - 1 should be clamped to 231 - 1. Return the integer as the final result.  Note:  Only the space character ' ' is considered a whitespace character. Do not ignore any characters other than the leading whitespace or the rest of the string after the digits.   ",string-to-integer-atoi,String to Integer (atoi),String,9
"You are given a string s and an integer k, a k duplicate removal consists of choosing k adjacent and equal letters from s and removing them, causing the left and the right side of the deleted substring to concatenate together. We repeatedly make k duplicate removals on s until we no longer can. Return the final string after all such duplicate removals have been made. It is guaranteed that the answer is unique.  ",remove-all-adjacent-duplicates-in-string-ii,Remove All Adjacent Duplicates in String II,"String, Stack",8
"Design and implement a data structure for a Least Frequently Used (LFU) cache. Implement the LFUCache class:  LFUCache(int capacity) Initializes the object with the capacity of the data structure. int get(int key) Gets the value of the key if the key exists in the cache. Otherwise, returns -1. void put(int key, int value) Update the value of the key if present, or inserts the key if not already present. When the cache reaches its capacity, it should invalidate and remove the least frequently used key before inserting a new item. For this problem, when there is a tie (i.e., two or more keys with the same frequency), the least recently used key would be invalidated.  To determine the least frequently used key, a use counter is maintained for each key in the cache. The key with the smallest use counter is the least frequently used key. When a key is first inserted into the cache, its use counter is set to 1 (due to the put operation). The use counter for a key in the cache is incremented either a get or put operation is called on it. The functions get and put must each run in O(1) average time complexity.  ",lfu-cache,LFU Cache,"Hash Table, Linked List, Design, Doubly-Linked List",8
"Given a root node reference of a BST and a key, delete the node with the given key in the BST. Return the root node reference (possibly updated) of the BST. Basically, the deletion can be divided into two stages:  Search for a node to remove. If the node is found, delete the node.   ",delete-node-in-a-bst,Delete Node in a BST,"Tree, Binary Search Tree, Binary Tree",8
"Given an array of characters chars, compress it using the following algorithm: Begin with an empty string s. For each group of consecutive repeating characters in chars:  If the group's length is 1, append the character to s. Otherwise, append the character followed by the group's length.  The compressed string s should not be returned separately, but instead, be stored in the input character array chars. Note that group lengths that are 10 or longer will be split into multiple characters in chars. After you are done modifying the input array, return the new length of the array. You must write an algorithm that uses only constant extra space.  ",string-compression,String Compression,"Two Pointers, String",8
"Given an integer array nums, move all 0's to the end of it while maintaining the relative order of the non-zero elements. Note that you must do this in-place without making a copy of the array.  ",move-zeroes,Move Zeroes,"Array, Two Pointers",8
"Given an array nums containing n distinct numbers in the range [0, n], return the only number in the range that is missing from the array.  ",missing-number,Missing Number,"Array, Hash Table, Math, Binary Search, Bit Manipulation, Sorting",8
"Given two strings s and t, return true if t is an anagram of s, and false otherwise. An Anagram is a word or phrase formed by rearranging the letters of a different word or phrase, typically using all the original letters exactly once.  ",valid-anagram,Valid Anagram,"Hash Table, String, Sorting",8
"Implement a first in first out (FIFO) queue using only two stacks. The implemented queue should support all the functions of a normal queue (push, peek, pop, and empty). Implement the MyQueue class:  void push(int x) Pushes element x to the back of the queue. int pop() Removes the element from the front of the queue and returns it. int peek() Returns the element at the front of the queue. boolean empty() Returns true if the queue is empty, false otherwise.  Notes:  You must use only standard operations of a stack, which means only push to top, peek/pop from top, size, and is empty operations are valid. Depending on your language, the stack may not be supported natively. You may simulate a stack using a list or deque (double-ended queue) as long as you use only a stack's standard operations.   ",implement-queue-using-stacks,Implement Queue using Stacks,"Stack, Design, Queue",8
"A peak element is an element that is strictly greater than its neighbors. Given a 0-indexed integer array nums, find a peak element, and return its index. If the array contains multiple peaks, return the index to any of the peaks. You may imagine that nums[-1] = nums[n] = -∞. In other words, an element is always considered to be strictly greater than a neighbor that is outside the array. You must write an algorithm that runs in O(log n) time.  ",find-peak-element,Find Peak Element,"Array, Binary Search",8
"Given the heads of two singly linked-lists headA and headB, return the node at which the two lists intersect. If the two linked lists have no intersection at all, return null. For example, the following two linked lists begin to intersect at node c1:  The test cases are generated such that there are no cycles anywhere in the entire linked structure. Note that the linked lists must retain their original structure after the function returns. Custom Judge: The inputs to the judge are given as follows (your program is not given these inputs):  intersectVal - The value of the node where the intersection occurs. This is 0 if there is no intersected node. listA - The first linked list. listB - The second linked list. skipA - The number of nodes to skip ahead in listA (starting from the head) to get to the intersected node. skipB - The number of nodes to skip ahead in listB (starting from the head) to get to the intersected node.  The judge will then create the linked structure based on these inputs and pass the two heads, headA and headB to your program. If you correctly return the intersected node, then your solution will be accepted.  ",intersection-of-two-linked-lists,Intersection of Two Linked Lists,"Hash Table, Linked List, Two Pointers",8
"Suppose an array of length n sorted in ascending order is rotated between 1 and n times. For example, the array nums = [0,1,2,4,5,6,7] might become:  [4,5,6,7,0,1,2] if it was rotated 4 times. [0,1,2,4,5,6,7] if it was rotated 7 times.  Notice that rotating an array [a[0], a[1], a[2], ..., a[n-1]] 1 time results in the array [a[n-1], a[0], a[1], a[2], ..., a[n-2]]. Given the sorted rotated array nums of unique elements, return the minimum element of this array. You must write an algorithm that runs in O(log n) time.  ",find-minimum-in-rotated-sorted-array,Find Minimum in Rotated Sorted Array,"Array, Binary Search",8
"Given a non-empty array of integers nums, every element appears twice except for one. Find that single one. You must implement a solution with a linear runtime complexity and use only constant extra space.  ",single-number,Single Number,"Array, Bit Manipulation",8
There are n children standing in a line. Each child is assigned a rating value given in the integer array ratings. You are giving candies to these children subjected to the following requirements:  Each child must have at least one candy. Children with a higher rating get more candies than their neighbors.  Return the minimum number of candies you need to have to distribute the candies to the children.  ,candy,Candy,"Array, Greedy",8
"Given a reference of a node in a connected undirected graph. Return a deep copy (clone) of the graph. Each node in the graph contains a value (int) and a list (List[Node]) of its neighbors.  class Node {     public int val;     public List<Node> neighbors; }    Test case format: For simplicity, each node's value is the same as the node's index (1-indexed). For example, the first node with val == 1, the second node with val == 2, and so on. The graph is represented in the test case using an adjacency list. An adjacency list is a collection of unordered lists used to represent a finite graph. Each list describes the set of neighbors of a node in the graph. The given node will always be the first node with val = 1. You must return the copy of the given node as a reference to the cloned graph.  ",clone-graph,Clone Graph,"Hash Table, Depth-First Search, Breadth-First Search, Graph",8
"A phrase is a palindrome if, after converting all uppercase letters into lowercase letters and removing all non-alphanumeric characters, it reads the same forward and backward. Alphanumeric characters include letters and numbers. Given a string s, return true if it is a palindrome, or false otherwise.  ",valid-palindrome,Valid Palindrome,"Two Pointers, String",8
"Given the root of a binary tree, return the level order traversal of its nodes' values. (i.e., from left to right, level by level).  ",binary-tree-level-order-traversal,Binary Tree Level Order Traversal,"Tree, Breadth-First Search, Binary Tree",8
"Given the root of a binary tree, check whether it is a mirror of itself (i.e., symmetric around its center).  ",symmetric-tree,Symmetric Tree,"Tree, Depth-First Search, Breadth-First Search, Binary Tree",8
"Given an array nums with n objects colored red, white, or blue, sort them in-place so that objects of the same color are adjacent, with the colors in the order red, white, and blue. We will use the integers 0, 1, and 2 to represent the color red, white, and blue, respectively. You must solve this problem without using the library's sort function.  ",sort-colors,Sort Colors,"Array, Two Pointers, Sorting",8
"Given two strings word1 and word2, return the minimum number of operations required to convert word1 to word2. You have the following three operations permitted on a word:  Insert a character Delete a character Replace a character   ",edit-distance,Edit Distance,"String, Dynamic Programming",8
"Given a string path, which is an absolute path (starting with a slash '/') to a file or directory in a Unix-style file system, convert it to the simplified canonical path. In a Unix-style file system, a period '.' refers to the current directory, a double period '..' refers to the directory up a level, and any multiple consecutive slashes (i.e. '//') are treated as a single slash '/'. For this problem, any other format of periods such as '...' are treated as file/directory names. The canonical path should have the following format:  The path starts with a single slash '/'. Any two directories are separated by a single slash '/'. The path does not end with a trailing '/'. The path only contains the directories on the path from the root directory to the target file or directory (i.e., no period '.' or double period '..')  Return the simplified canonical path.  ",simplify-path,Simplify Path,"String, Stack",8
"There is a robot on an m x n grid. The robot is initially located at the top-left corner (i.e., grid[0][0]). The robot tries to move to the bottom-right corner (i.e., grid[m - 1][n - 1]). The robot can only move either down or right at any point in time. Given the two integers m and n, return the number of possible unique paths that the robot can take to reach the bottom-right corner. The test cases are generated so that the answer will be less than or equal to 2 * 109.  ",unique-paths,Unique Paths,"Math, Dynamic Programming, Combinatorics",8
"You are given an n x n 2D matrix representing an image, rotate the image by 90 degrees (clockwise). You have to rotate the image in-place, which means you have to modify the input 2D matrix directly. DO NOT allocate another 2D matrix and do the rotation.  ",rotate-image,Rotate Image,"Array, Math, Matrix",8
"Given a linked list, swap every two adjacent nodes and return its head. You must solve the problem without modifying the values in the list's nodes (i.e., only nodes themselves may be changed.)  ",swap-nodes-in-pairs,Swap Nodes in Pairs,"Linked List, Recursion",8
"Given an input string s and a pattern p, implement regular expression matching with support for '.' and '*' where:  '.' Matches any single character.​​​​ '*' Matches zero or more of the preceding element.  The matching should cover the entire input string (not partial).  ",regular-expression-matching,Regular Expression Matching,"String, Dynamic Programming, Recursion",8
"Given the root of a binary tree, return all duplicate subtrees. For each kind of duplicate subtrees, you only need to return the root node of any one of them. Two trees are duplicate if they have the same structure with the same node values.  ",find-duplicate-subtrees,Find Duplicate Subtrees,"Hash Table, Tree, Depth-First Search, Binary Tree",7
"Given a binary array nums, return the maximum length of a contiguous subarray with an equal number of 0 and 1.  ",contiguous-array,Contiguous Array,"Array, Hash Table, Prefix Sum",7
"You are given an integer array nums and an integer target. You want to build an expression out of nums by adding one of the symbols '+' and '-' before each integer in nums and then concatenate all the integers.  For example, if nums = [2, 1], you can add a '+' before 2 and a '-' before 1 and concatenate them to build the expression ""+2-1"".  Return the number of different expressions that you can build, which evaluates to target.  ",target-sum,Target Sum,"Array, Dynamic Programming, Backtracking",7
"Given a string s representing a valid expression, implement a basic calculator to evaluate it, and return the result of the evaluation. Note: You are not allowed to use any built-in function which evaluates strings as mathematical expressions, such as eval().  ",basic-calculator,Basic Calculator,"Math, String, Stack, Recursion",7
"Given two strings s and t, determine if they are isomorphic. Two strings s and t are isomorphic if the characters in s can be replaced to get t. All occurrences of a character must be replaced with another character while preserving the order of characters. No two characters may map to the same character, but a character may map to itself.  ",isomorphic-strings,Isomorphic Strings,"Hash Table, String",7
"Given two version numbers, version1 and version2, compare them.   Version numbers consist of one or more revisions joined by a dot '.'. Each revision consists of digits and may contain leading zeros. Every revision contains at least one character. Revisions are 0-indexed from left to right, with the leftmost revision being revision 0, the next revision being revision 1, and so on. For example 2.5.33 and 0.1 are valid version numbers. To compare version numbers, compare their revisions in left-to-right order. Revisions are compared using their integer value ignoring any leading zeros. This means that revisions 1 and 001 are considered equal. If a version number does not specify a revision at an index, then treat the revision as 0. For example, version 1.0 is less than version 1.1 because their revision 0s are the same, but their revision 1s are 0 and 1 respectively, and 0 < 1. Return the following:  If version1 < version2, return -1. If version1 > version2, return 1. Otherwise, return 0.   ",compare-version-numbers,Compare Version Numbers,"Two Pointers, String",7
"Given the head of a linked list, return the node where the cycle begins. If there is no cycle, return null. There is a cycle in a linked list if there is some node in the list that can be reached again by continuously following the next pointer. Internally, pos is used to denote the index of the node that tail's next pointer is connected to (0-indexed). It is -1 if there is no cycle. Note that pos is not passed as a parameter. Do not modify the linked list.  ",linked-list-cycle-ii,Linked List Cycle II,"Hash Table, Linked List, Two Pointers",7
"You are given an array prices where prices[i] is the price of a given stock on the ith day. Find the maximum profit you can achieve. You may complete at most two transactions. Note: You may not engage in multiple transactions simultaneously (i.e., you must sell the stock before you buy again).  ",best-time-to-buy-and-sell-stock-iii,Best Time to Buy and Sell Stock III,"Array, Dynamic Programming",7
"Given the head of a singly linked list where elements are sorted in ascending order, convert it to a height-balanced binary search tree.  ",convert-sorted-list-to-binary-search-tree,Convert Sorted List to Binary Search Tree,"Linked List, Divide and Conquer, Tree, Binary Search Tree, Binary Tree",7
"Given a m x n grid filled with non-negative numbers, find a path from top left to bottom right, which minimizes the sum of all numbers along its path. Note: You can only move either down or right at any point in time.  ",minimum-path-sum,Minimum Path Sum,"Array, Dynamic Programming, Matrix",7
"You are given an m x n integer array grid. There is a robot initially located at the top-left corner (i.e., grid[0][0]). The robot tries to move to the bottom-right corner (i.e., grid[m - 1][n - 1]). The robot can only move either down or right at any point in time. An obstacle and space are marked as 1 or 0 respectively in grid. A path that the robot takes cannot include any square that is an obstacle. Return the number of possible unique paths that the robot can take to reach the bottom-right corner. The testcases are generated so that the answer will be less than or equal to 2 * 109.  ",unique-paths-ii,Unique Paths II,"Array, Dynamic Programming, Matrix",7
"The n-queens puzzle is the problem of placing n queens on an n x n chessboard such that no two queens attack each other. Given an integer n, return all distinct solutions to the n-queens puzzle. You may return the answer in any order. Each solution contains a distinct board configuration of the n-queens' placement, where 'Q' and '.' both indicate a queen and an empty space, respectively.  ",n-queens,N-Queens,"Array, Backtracking",7
Write a program to solve a Sudoku puzzle by filling the empty cells. A sudoku solution must satisfy all of the following rules:  Each of the digits 1-9 must occur exactly once in each row. Each of the digits 1-9 must occur exactly once in each column. Each of the digits 1-9 must occur exactly once in each of the 9 3x3 sub-boxes of the grid.  The '.' character indicates empty cells.  ,sudoku-solver,Sudoku Solver,"Array, Hash Table, Backtracking, Matrix",7
"Given an integer x, return true if x is a palindrome, and false otherwise.  ",palindrome-number,Palindrome Number,Math,7
"Anti-theft security devices are activated inside a bank. You are given a 0-indexed binary string array bank representing the floor plan of the bank, which is an m x n 2D matrix. bank[i] represents the ith row, consisting of '0's and '1's. '0' means the cell is empty, while'1' means the cell has a security device. There is one laser beam between any two security devices if both conditions are met:  The two devices are located on two different rows: r1 and r2, where r1 < r2. For each row i where r1 < i < r2, there are no security devices in the ith row.  Laser beams are independent, i.e., one beam does not interfere nor join with another. Return the total number of laser beams in the bank.  ",number-of-laser-beams-in-a-bank,Number of Laser Beams in a Bank,"Array, Math, String, Matrix",6
"A company has n employees with a unique ID for each employee from 0 to n - 1. The head of the company is the one with headID. Each employee has one direct manager given in the manager array where manager[i] is the direct manager of the i-th employee, manager[headID] = -1. Also, it is guaranteed that the subordination relationships have a tree structure. The head of the company wants to inform all the company employees of an urgent piece of news. He will inform his direct subordinates, and they will inform their subordinates, and so on until all employees know about the urgent news. The i-th employee needs informTime[i] minutes to inform all of his direct subordinates (i.e., After informTime[i] minutes, all his direct subordinates can start spreading the news). Return the number of minutes needed to inform all the employees about the urgent news.  ",time-needed-to-inform-all-employees,Time Needed to Inform All Employees,"Tree, Depth-First Search, Breadth-First Search",6
