problem_statement,titleslug,title,tags,num_occur
"Given two non-negative integers num1 and num2 represented as strings, return the product of num1 and num2, also represented as a string. Note: You must not use any built-in BigInteger library or convert the inputs to integer directly.  ",multiply-strings,Multiply Strings,"Math, String, Simulation",5
"Given an integer array nums and an integer val, remove all occurrences of val in nums in-place. The order of the elements may be changed. Then return the number of elements in nums which are not equal to val. Consider the number of elements in nums which are not equal to val be k, to get accepted, you need to do the following things:  Change the array nums such that the first k elements of nums contain the elements which are not equal to val. The remaining elements of nums are not important as well as the size of nums. Return k.  Custom Judge: The judge will test your solution with the following code:  int[] nums = [...]; // Input array int val = ...; // Value to remove int[] expectedNums = [...]; // The expected answer with correct length.                             // It is sorted with no values equaling val.  int k = removeElement(nums, val); // Calls your implementation  assert k == expectedNums.length; sort(nums, 0, k); // Sort the first k elements of nums for (int i = 0; i < actualLength; i++) {     assert nums[i] == expectedNums[i]; }  If all assertions pass, then your solution will be accepted.  ",remove-element,Remove Element,"Array, Two Pointers",5
"The string ""PAYPALISHIRING"" is written in a zigzag pattern on a given number of rows like this: (you may want to display this pattern in a fixed font for better legibility)  P   A   H   N A P L S I I G Y   I   R  And then read line by line: ""PAHNAPLSIIGYIR"" Write the code that will take a string and make this conversion given a number of rows:  string convert(string s, int numRows);   ",zigzag-conversion,Zigzag Conversion,String,5
"You are given an integer array prices representing the daily price history of a stock, where prices[i] is the stock price on the ith day. A smooth descent period of a stock consists of one or more contiguous days such that the price on each day is lower than the price on the preceding day by exactly 1. The first day of the period is exempted from this rule. Return the number of smooth descent periods.  ",number-of-smooth-descent-periods-of-a-stock,Number of Smooth Descent Periods of a Stock,"Array, Math, Dynamic Programming",4
"There is a bi-directional graph with n vertices, where each vertex is labeled from 0 to n - 1 (inclusive). The edges in the graph are represented as a 2D integer array edges, where each edges[i] = [ui, vi] denotes a bi-directional edge between vertex ui and vertex vi. Every vertex pair is connected by at most one edge, and no vertex has an edge to itself. You want to determine if there is a valid path that exists from vertex source to vertex destination. Given edges and the integers n, source, and destination, return true if there is a valid path from source to destination, or false otherwise.  ",find-if-path-exists-in-graph,Find if Path Exists in Graph,"Depth-First Search, Breadth-First Search, Union Find, Graph",4
"Given an integer array arr, remove a subarray (can be empty) from arr such that the remaining elements in arr are non-decreasing. Return the length of the shortest subarray to remove. A subarray is a contiguous subsequence of the array.  ",shortest-subarray-to-be-removed-to-make-array-sorted,Shortest Subarray to be Removed to Make Array Sorted,"Array, Two Pointers, Binary Search, Stack, Monotonic Stack",4
"Given an array of integers arr, you are initially positioned at the first index of the array. In one step you can jump from index i to index:  i + 1 where: i + 1 < arr.length. i - 1 where: i - 1 >= 0. j where: arr[i] == arr[j] and i != j.  Return the minimum number of steps to reach the last index of the array. Notice that you can not jump outside of the array at any time.  ",jump-game-iv,Jump Game IV,"Array, Hash Table, Breadth-First Search",4
"Given the root of a binary tree, split the binary tree into two subtrees by removing one edge such that the product of the sums of the subtrees is maximized. Return the maximum product of the sums of the two subtrees. Since the answer may be too large, return it modulo 109 + 7. Note that you need to maximize the answer before taking the mod and not after taking it.  ",maximum-product-of-splitted-binary-tree,Maximum Product of Splitted Binary Tree,"Tree, Depth-First Search, Binary Tree",4
You are given a string s consisting of lowercase English letters. A duplicate removal consists of choosing two adjacent and equal letters and removing them. We repeatedly make duplicate removals on s until we no longer can. Return the final string after all such duplicate removals have been made. It can be proven that the answer is unique.  ,remove-all-adjacent-duplicates-in-string,Remove All Adjacent Duplicates In String,"String, Stack",4
"You are given an array of integers stones where stones[i] is the weight of the ith stone. We are playing a game with the stones. On each turn, we choose the heaviest two stones and smash them together. Suppose the heaviest two stones have weights x and y with x <= y. The result of this smash is:  If x == y, both stones are destroyed, and If x != y, the stone of weight x is destroyed, and the stone of weight y has new weight y - x.  At the end of the game, there is at most one stone left. Return the weight of the last remaining stone. If there are no stones left, return 0.  ",last-stone-weight,Last Stone Weight,"Array, Heap (Priority Queue)",4
"Given an integer array arr, partition the array into (contiguous) subarrays of length at most k. After partitioning, each subarray has their values changed to become the maximum value of that subarray. Return the largest sum of the given array after partitioning. Test cases are generated so that the answer fits in a 32-bit integer.  ",partition-array-for-maximum-sum,Partition Array for Maximum Sum,"Array, Dynamic Programming",4
"Given the root of a binary tree, find the maximum value v for which there exist different nodes a and b where v = |a.val - b.val| and a is an ancestor of b. A node a is an ancestor of b if either: any child of a is equal to b or any child of a is an ancestor of b.  ",maximum-difference-between-node-and-ancestor,Maximum Difference Between Node and Ancestor,"Tree, Depth-First Search, Binary Tree",4
"Given an array of integers preorder, which represents the preorder traversal of a BST (i.e., binary search tree), construct the tree and return its root. It is guaranteed that there is always possible to find a binary search tree with the given requirements for the given test cases. A binary search tree is a binary tree where for every node, any descendant of Node.left has a value strictly less than Node.val, and any descendant of Node.right has a value strictly greater than Node.val. A preorder traversal of a binary tree displays the value of the node first, then traverses Node.left, then traverses Node.right.  ",construct-binary-search-tree-from-preorder-traversal,Construct Binary Search Tree from Preorder Traversal,"Array, Stack, Tree, Binary Search Tree, Monotonic Stack, Binary Tree",4
"Given a string array words, return an array of all characters that show up in all strings within the words (including duplicates). You may return the answer in any order.  ",find-common-characters,Find Common Characters,"Array, Hash Table, String",4
"Given two integer arrays pushed and popped each with distinct values, return true if this could have been the result of a sequence of push and pop operations on an initially empty stack, or false otherwise.  ",validate-stack-sequences,Validate Stack Sequences,"Array, Stack, Simulation",4
"Given the root node of a binary search tree and two integers low and high, return the sum of values of all nodes with a value in the inclusive range [low, high].  ",range-sum-of-bst,Range Sum of BST,"Tree, Depth-First Search, Binary Search Tree, Binary Tree",4
"You are visiting a farm that has a single row of fruit trees arranged from left to right. The trees are represented by an integer array fruits where fruits[i] is the type of fruit the ith tree produces. You want to collect as much fruit as possible. However, the owner has some strict rules that you must follow:  You only have two baskets, and each basket can only hold a single type of fruit. There is no limit on the amount of fruit each basket can hold. Starting from any tree of your choice, you must pick exactly one fruit from every tree (including the start tree) while moving to the right. The picked fruits must fit in one of your baskets. Once you reach a tree with fruit that cannot fit in your baskets, you must stop.  Given the integer array fruits, return the maximum number of fruits you can pick.  ",fruit-into-baskets,Fruit Into Baskets,"Array, Hash Table, Sliding Window",4
"You are given an array people where people[i] is the weight of the ith person, and an infinite number of boats where each boat can carry a maximum weight of limit. Each boat carries at most two people at the same time, provided the sum of the weight of those people is at most limit. Return the minimum number of boats to carry every given person.  ",boats-to-save-people,Boats to Save People,"Array, Two Pointers, Greedy, Sorting",4
"Given a balanced parentheses string s, return the score of the string. The score of a balanced parentheses string is based on the following rule:  ""()"" has score 1. AB has score A + B, where A and B are balanced parentheses strings. (A) has score 2 * A, where A is a balanced parentheses string.   ",score-of-parentheses,Score of Parentheses,"String, Stack",4
"You are given a string s. We want to partition the string into as many parts as possible so that each letter appears in at most one part. Note that the partition is done so that after concatenating all the parts in order, the resultant string should be s. Return a list of integers representing the size of these parts.  ",partition-labels,Partition Labels,"Hash Table, Two Pointers, String, Greedy",4
"You are implementing a program to use as your calendar. We can add a new event if adding the event will not cause a double booking. A double booking happens when two events have some non-empty intersection (i.e., some moment is common to both events.). The event can be represented as a pair of integers start and end that represents a booking on the half-open interval [start, end), the range of real numbers x such that start <= x < end. Implement the MyCalendar class:  MyCalendar() Initializes the calendar object. boolean book(int start, int end) Returns true if the event can be added to the calendar successfully without causing a double booking. Otherwise, return false and do not add the event to the calendar.   ",my-calendar-i,My Calendar I,"Binary Search, Design, Segment Tree, Ordered Set",4
"Design a class to find the kth largest element in a stream. Note that it is the kth largest element in the sorted order, not the kth distinct element. Implement KthLargest class:  KthLargest(int k, int[] nums) Initializes the object with the integer k and the stream of integers nums. int add(int val) Appends the integer val to the stream and returns the element representing the kth largest element in the stream.   ",kth-largest-element-in-a-stream,Kth Largest Element in a Stream,"Tree, Design, Binary Search Tree, Heap (Priority Queue), Binary Tree, Data Stream",4
You are given an integer num. You can swap two digits at most once to get the maximum valued number. Return the maximum valued number you can get.  ,maximum-swap,Maximum Swap,"Math, Greedy",4
"There is only one character 'A' on the screen of a notepad. You can perform one of two operations on this notepad for each step:  Copy All: You can copy all the characters present on the screen (a partial copy is not allowed). Paste: You can paste the characters which are copied last time.  Given an integer n, return the minimum number of operations to get the character 'A' exactly n times on the screen.  ",2-keys-keyboard,2 Keys Keyboard,"Math, Dynamic Programming",4
"Solve a given equation and return the value of 'x' in the form of a string ""x=#value"". The equation contains only '+', '-' operation, the variable 'x' and its coefficient. You should return ""No solution"" if there is no solution for the equation, or ""Infinite solutions"" if there are infinite solutions for the equation. If there is exactly one solution for the equation, we ensure that the value of 'x' is an integer.  ",solve-the-equation,Solve the Equation,"Math, String, Simulation",4
"Given the root of a binary tree, return the average value of the nodes on each level in the form of an array. Answers within 10-5 of the actual answer will be accepted.  ",average-of-levels-in-binary-tree,Average of Levels in Binary Tree,"Tree, Depth-First Search, Breadth-First Search, Binary Tree",4
"Design your implementation of the circular queue. The circular queue is a linear data structure in which the operations are performed based on FIFO (First In First Out) principle, and the last position is connected back to the first position to make a circle. It is also called ""Ring Buffer"". One of the benefits of the circular queue is that we can make use of the spaces in front of the queue. In a normal queue, once the queue becomes full, we cannot insert the next element even if there is a space in front of the queue. But using the circular queue, we can use the space to store new values. Implement the MyCircularQueue class:  MyCircularQueue(k) Initializes the object with the size of the queue to be k. int Front() Gets the front item from the queue. If the queue is empty, return -1. int Rear() Gets the last item from the queue. If the queue is empty, return -1. boolean enQueue(int value) Inserts an element into the circular queue. Return true if the operation is successful. boolean deQueue() Deletes an element from the circular queue. Return true if the operation is successful. boolean isEmpty() Checks whether the circular queue is empty or not. boolean isFull() Checks whether the circular queue is full or not.  You must solve the problem without using the built-in queue data structure in your programming language.   ",design-circular-queue,Design Circular Queue,"Array, Linked List, Design, Queue",4
Note: This is a companion problem to the System Design problem: Design TinyURL. TinyURL is a URL shortening service where you enter a URL such as https://leetcode.com/problems/design-tinyurl and it returns a short URL such as http://tinyurl.com/4e9iAk. Design a class to encode a URL and decode a tiny URL. There is no restriction on how your encode/decode algorithm should work. You just need to ensure that a URL can be encoded to a tiny URL and the tiny URL can be decoded to the original URL. Implement the Solution class:  Solution() Initializes the object of the system. String encode(String longUrl) Returns a tiny URL for the given longUrl. String decode(String shortUrl) Returns the original long URL for the given shortUrl. It is guaranteed that the given shortUrl was encoded by the same object.   ,encode-and-decode-tinyurl,Encode and Decode TinyURL,"Hash Table, String, Design, Hash Function",4
"Given an array of n integers nums, a 132 pattern is a subsequence of three integers nums[i], nums[j] and nums[k] such that i < j < k and nums[i] < nums[k] < nums[j]. Return true if there is a 132 pattern in nums, otherwise, return false.  ",132-pattern,132 Pattern,"Array, Binary Search, Stack, Monotonic Stack, Ordered Set",4
"Given an array of intervals intervals where intervals[i] = [starti, endi], return the minimum number of intervals you need to remove to make the rest of the intervals non-overlapping.  ",non-overlapping-intervals,Non-overlapping Intervals,"Array, Dynamic Programming, Greedy, Sorting",4
"Given an integer array nums, return true if you can partition the array into two subsets such that the sum of the elements in both subsets is equal or false otherwise.  ",partition-equal-subset-sum,Partition Equal Subset Sum,"Array, Dynamic Programming",4
"Given two strings s and t, return true if s is a subsequence of t, or false otherwise. A subsequence of a string is a new string that is formed from the original string by deleting some (can be none) of the characters without disturbing the relative positions of the remaining characters. (i.e., ""ace"" is a subsequence of ""abcde"" while ""aec"" is not).  ",is-subsequence,Is Subsequence,"Two Pointers, String, Dynamic Programming",4
"Given an array of distinct integers nums and a target integer target, return the number of possible combinations that add up to target. The test cases are generated so that the answer can fit in a 32-bit integer.  ",combination-sum-iv,Combination Sum IV,"Array, Dynamic Programming",4
"Given two integer arrays nums1 and nums2, return an array of their intersection. Each element in the result must appear as many times as it shows in both arrays and you may return the result in any order.  ",intersection-of-two-arrays-ii,Intersection of Two Arrays II,"Array, Hash Table, Two Pointers, Binary Search, Sorting",4
"You are given a list of airline tickets where tickets[i] = [fromi, toi] represent the departure and the arrival airports of one flight. Reconstruct the itinerary in order and return it. All of the tickets belong to a man who departs from ""JFK"", thus, the itinerary must begin with ""JFK"". If there are multiple valid itineraries, you should return the itinerary that has the smallest lexical order when read as a single string.  For example, the itinerary [""JFK"", ""LGA""] has a smaller lexical order than [""JFK"", ""LGB""].  You may assume all tickets form at least one valid itinerary. You must use all the tickets once and only once.  ",reconstruct-itinerary,Reconstruct Itinerary,"Depth-First Search, Graph, Eulerian Circuit",4
"Given the head of a singly linked list, group all the nodes with odd indices together followed by the nodes with even indices, and return the reordered list. The first node is considered odd, and the second node is even, and so on. Note that the relative order inside both the even and odd groups should remain as it was in the input. You must solve the problem in O(1) extra space complexity and O(n) time complexity.  ",odd-even-linked-list,Odd Even Linked List,Linked List,4
"Given a pattern and a string s, find if s follows the same pattern. Here follow means a full match, such that there is a bijection between a letter in pattern and a non-empty word in s.  ",word-pattern,Word Pattern,"Hash Table, String",4
"Given an integer array of size n, find all elements that appear more than ⌊ n/3 ⌋ times.  ",majority-element-ii,Majority Element II,"Array, Hash Table, Sorting, Counting",4
"You are a professional robber planning to rob houses along a street. Each house has a certain amount of money stashed. All houses at this place are arranged in a circle. That means the first house is the neighbor of the last one. Meanwhile, adjacent houses have a security system connected, and it will automatically contact the police if two adjacent houses were broken into on the same night. Given an integer array nums representing the amount of money of each house, return the maximum amount of money you can rob tonight without alerting the police.  ",house-robber-ii,House Robber II,"Array, Dynamic Programming",4
"Given an integer n, return the number of prime numbers that are strictly less than n.  ",count-primes,Count Primes,"Array, Math, Enumeration, Number Theory",4
"Given the head of a linked list and an integer val, remove all the nodes of the linked list that has Node.val == val, and return the new head.  ",remove-linked-list-elements,Remove Linked List Elements,"Linked List, Recursion",4
"You are given an integer array prices where prices[i] is the price of a given stock on the ith day, and an integer k. Find the maximum profit you can achieve. You may complete at most k transactions: i.e. you may buy at most k times and sell at most k times. Note: You may not engage in multiple transactions simultaneously (i.e., you must sell the stock before you buy again).  ",best-time-to-buy-and-sell-stock-iv,Best Time to Buy and Sell Stock IV,"Array, Dynamic Programming",4
"Implement the BSTIterator class that represents an iterator over the in-order traversal of a binary search tree (BST):  BSTIterator(TreeNode root) Initializes an object of the BSTIterator class. The root of the BST is given as part of the constructor. The pointer should be initialized to a non-existent number smaller than any element in the BST. boolean hasNext() Returns true if there exists a number in the traversal to the right of the pointer, otherwise returns false. int next() Moves the pointer to the right, then returns the number at the pointer.  Notice that by initializing the pointer to a non-existent smallest number, the first call to next() will return the smallest element in the BST. You may assume that next() calls will always be valid. That is, there will be at least a next number in the in-order traversal when next() is called.  ",binary-search-tree-iterator,Binary Search Tree Iterator,"Stack, Tree, Design, Binary Search Tree, Binary Tree, Iterator",4
"Given an integer n, return the number of trailing zeroes in n!. Note that n! = n * (n - 1) * (n - 2) * ... * 3 * 2 * 1.  ",factorial-trailing-zeroes,Factorial Trailing Zeroes,Math,4
"Given an array of points where points[i] = [xi, yi] represents a point on the X-Y plane, return the maximum number of points that lie on the same straight line.  ",max-points-on-a-line,Max Points on a Line,"Array, Hash Table, Math, Geometry",4
"Given a triangle array, return the minimum path sum from top to bottom. For each step, you may move to an adjacent number of the row below. More formally, if you are on index i on the current row, you may move to either index i or index i + 1 on the next row.  ",triangle,Triangle,"Array, Dynamic Programming",4
"Given two strings s and t, return the number of distinct subsequences of s which equals t. The test cases are generated so that the answer fits on a 32-bit signed integer.  ",distinct-subsequences,Distinct Subsequences,"String, Dynamic Programming",4
"Given the root of a binary tree, return its maximum depth. A binary tree's maximum depth is the number of nodes along the longest path from the root node down to the farthest leaf node.  ",maximum-depth-of-binary-tree,Maximum Depth of Binary Tree,"Tree, Depth-First Search, Breadth-First Search, Binary Tree",4
"Given strings s1, s2, and s3, find whether s3 is formed by an interleaving of s1 and s2. An interleaving of two strings s and t is a configuration where s and t are divided into n and m substrings respectively, such that:  s = s1 + s2 + ... + sn t = t1 + t2 + ... + tm |n - m| <= 1 The interleaving is s1 + t1 + s2 + t2 + s3 + t3 + ... or t1 + s1 + t2 + s2 + t3 + s3 + ...  Note: a + b is the concatenation of strings a and b.  ",interleaving-string,Interleaving String,"String, Dynamic Programming",4
"Given an integer n, return the number of structurally unique BST's (binary search trees) which has exactly n nodes of unique values from 1 to n.  ",unique-binary-search-trees,Unique Binary Search Trees,"Math, Dynamic Programming, Tree, Binary Search Tree, Binary Tree",4
"Given the root of a binary tree, return the inorder traversal of its nodes' values.  ",binary-tree-inorder-traversal,Binary Tree Inorder Traversal,"Stack, Tree, Depth-First Search, Binary Tree",4
"Given a collection of numbers, nums, that might contain duplicates, return all possible unique permutations in any order.  ",permutations-ii,Permutations II,"Array, Backtracking",4
"Given a collection of candidate numbers (candidates) and a target number (target), find all unique combinations in candidates where the candidate numbers sum to target. Each number in candidates may only be used once in the combination. Note: The solution set must not contain duplicate combinations.  ",combination-sum-ii,Combination Sum II,"Array, Backtracking",4
"There is a long table with a line of plates and candles arranged on top of it. You are given a 0-indexed string s consisting of characters '*' and '|' only, where a '*' represents a plate and a '|' represents a candle. You are also given a 0-indexed 2D integer array queries where queries[i] = [lefti, righti] denotes the substring s[lefti...righti] (inclusive). For each query, you need to find the number of plates between candles that are in the substring. A plate is considered between candles if there is at least one candle to its left and at least one candle to its right in the substring.  For example, s = ""||**||**|*"", and a query [3, 8] denotes the substring ""*||**|"". The number of plates between candles in this substring is 2, as each of the two plates has at least one candle in the substring to its left and right.  Return an integer array answer where answer[i] is the answer to the ith query.  ",plates-between-candles,Plates Between Candles,"Array, String, Binary Search, Prefix Sum",3
"You are given the head of a linked list, and an integer k. Return the head of the linked list after swapping the values of the kth node from the beginning and the kth node from the end (the list is 1-indexed).  ",swapping-nodes-in-a-linked-list,Swapping Nodes in a Linked List,"Linked List, Two Pointers",3
