problem_statement,titleslug,title,tags,num_occur
" A cinema has n rows of seats, numbered from 1 to n and there are ten seats in each row, labelled from 1 to 10 as shown in the figure above. Given the array reservedSeats containing the numbers of seats already reserved, for example, reservedSeats[i] = [3,8] means the seat located in row 3 and labelled with 8 is already reserved. Return the maximum number of four-person groups you can assign on the cinema seats. A four-person group occupies four adjacent seats in one single row. Seats across an aisle (such as [3,3] and [3,4]) are not considered to be adjacent, but there is an exceptional case on which an aisle split a four-person group, in that case, the aisle split a four-person group in the middle, which means to have two people on each side.  ",cinema-seat-allocation,Cinema Seat Allocation,"Array, Hash Table, Greedy, Bit Manipulation",2
Given two binary trees original and cloned and given a reference to a node target in the original tree. The cloned tree is a copy of the original tree. Return a reference to the same node in the cloned tree. Note that you are not allowed to change any of the two trees or the target node and the answer must be a reference to a node in the cloned tree.  ,find-a-corresponding-node-of-a-binary-tree-in-a-clone-of-that-tree,Find a Corresponding Node of a Binary Tree in a Clone of That Tree,"Tree, Depth-First Search, Breadth-First Search, Binary Tree",2
"Given an undirected tree consisting of n vertices numbered from 1 to n. A frog starts jumping from vertex 1. In one second, the frog jumps from its current vertex to another unvisited vertex if they are directly connected. The frog can not jump back to a visited vertex. In case the frog can jump to several vertices, it jumps randomly to one of them with the same probability. Otherwise, when the frog can not jump to any unvisited vertex, it jumps forever on the same vertex. The edges of the undirected tree are given in the array edges, where edges[i] = [ai, bi] means that exists an edge connecting the vertices ai and bi. Return the probability that after t seconds the frog is on the vertex target. Answers within 10-5 of the actual answer will be accepted.  ",frog-position-after-t-seconds,Frog Position After T Seconds,"Tree, Depth-First Search, Breadth-First Search, Graph",2
"You are given a string s. Reorder the string using the following algorithm:  Pick the smallest character from s and append it to the result. Pick the smallest character from s which is greater than the last appended character to the result and append it. Repeat step 2 until you cannot pick more characters. Pick the largest character from s and append it to the result. Pick the largest character from s which is smaller than the last appended character to the result and append it. Repeat step 5 until you cannot pick more characters. Repeat the steps from 1 to 6 until you pick all characters from s.  In each step, If the smallest or the largest character appears more than once you can choose any occurrence and append it to the result. Return the result string after sorting s with this algorithm.  ",increasing-decreasing-string,Increasing Decreasing String,"Hash Table, String, Counting",2
Given a binary tree root and a linked list with head as the first node.  Return True if all the elements in the linked list starting from the head correspond to some downward path connected in the binary tree otherwise return False. In this context downward path means a path that starts at some node and goes downwards.  ,linked-list-in-binary-tree,Linked List in Binary Tree,"Linked List, Tree, Depth-First Search, Breadth-First Search, Binary Tree",2
"Given the array nums, for each nums[i] find out how many numbers in the array are smaller than it. That is, for each nums[i] you have to count the number of valid j's such that j != i and nums[j] < nums[i]. Return the answer in an array.  ",how-many-numbers-are-smaller-than-the-current-number,How Many Numbers Are Smaller Than the Current Number,"Array, Hash Table, Sorting, Counting",2
You are given an integer array arr. You can choose a set of integers and remove all the occurrences of these integers in the array. Return the minimum size of the set so that at least half of the integers of the array are removed.  ,reduce-array-size-to-the-half,Reduce Array Size to The Half,"Array, Hash Table, Greedy, Sorting, Heap (Priority Queue)",2
"Given a binary tree root and an integer target, delete all the leaf nodes with value target. Note that once you delete a leaf node with value target, if its parent node becomes a leaf node and has the value target, it should also be deleted (you need to continue doing that until you cannot).  ",delete-leaves-with-a-given-value,Delete Leaves With a Given Value,"Tree, Depth-First Search, Binary Tree",2
"Given the root of a binary tree, return the sum of values of nodes with an even-valued grandparent. If there are no nodes with an even-valued grandparent, return 0. A grandparent of a node is the parent of its parent if it exists.  ",sum-of-nodes-with-even-valued-grandparent,Sum of Nodes with Even-Valued Grandparent,"Tree, Depth-First Search, Breadth-First Search, Binary Tree",2
"Given a m x n matrix mat and an integer k, return a matrix answer where each answer[i][j] is the sum of all elements mat[r][c] for:  i - k <= r <= i + k, j - k <= c <= j + k, and (r, c) is a valid position in the matrix.   ",matrix-block-sum,Matrix Block Sum,"Array, Matrix, Prefix Sum",2
"We are given a list nums of integers representing a list compressed with run-length encoding. Consider each adjacent pair of elements [freq, val] = [nums[2*i], nums[2*i+1]] (with i >= 0).  For each such pair, there are freq elements with value val concatenated in a sublist. Concatenate all the sublists from left to right to generate the decompressed list. Return the decompressed list.  ",decompress-run-length-encoded-list,Decompress Run-Length Encoded List,Array,2
"Given two binary search trees root1 and root2, return a list containing all the integers from both trees sorted in ascending order.  ",all-elements-in-two-binary-search-trees,All Elements in Two Binary Search Trees,"Tree, Depth-First Search, Binary Search Tree, Sorting, Binary Tree",2
"Given a string s, return the maximum number of ocurrences of any substring under the following rules:  The number of unique characters in the substring must be less than or equal to maxLetters. The substring size must be between minSize and maxSize inclusive.   ",maximum-number-of-occurrences-of-a-substring,Maximum Number of Occurrences of a Substring,"Hash Table, String, Sliding Window",2
"Given an array nums of integers, return how many of them contain an even number of digits.  ",find-numbers-with-even-number-of-digits,Find Numbers with Even Number of Digits,Array,2
Given head which is a reference node to a singly-linked list. The value of each node in the linked list is either 0 or 1. The linked list holds the binary representation of a number. Return the decimal value of the number in the linked list. The most significant bit is at the head of the linked list.  ,convert-binary-number-in-a-linked-list-to-integer,Convert Binary Number in a Linked List to Integer,"Linked List, Math",2
"Balanced strings are those that have an equal quantity of 'L' and 'R' characters. Given a balanced string s, split it into some number of substrings such that:  Each substring is balanced.  Return the maximum number of balanced strings you can obtain.  ",split-a-string-in-balanced-strings,Split a String in Balanced Strings,"String, Greedy, Counting",2
"Return the number of permutations of 1 to n so that prime numbers are at prime indices (1-indexed.) (Recall that an integer is prime if and only if it is greater than 1, and cannot be written as a product of two positive integers both smaller than it.) Since the answer may be large, return the answer modulo 10^9 + 7.  ",prime-arrangements,Prime Arrangements,Math,2
"Given the head of a linked list, we repeatedly delete consecutive sequences of nodes that sum to 0 until there are no such sequences. After doing so, return the head of the final linked list.  You may return any such answer.   (Note that in the examples below, all sequences are serializations of ListNode objects.)",remove-zero-sum-consecutive-nodes-from-linked-list,Remove Zero Sum Consecutive Nodes from Linked List,"Hash Table, Linked List",2
You are given an array of strings words and a string chars. A string is good if it can be formed by characters from chars (each character can only be used once). Return the sum of lengths of all good strings in words.  ,find-words-that-can-be-formed-by-characters,Find Words That Can Be Formed by Characters,"Array, Hash Table, String",2
"On an alphabet board, we start at position (0, 0), corresponding to character board[0][0]. Here, board = [""abcde"", ""fghij"", ""klmno"", ""pqrst"", ""uvwxy"", ""z""], as shown in the diagram below.  We may make the following moves:  'U' moves our position up one row, if the position exists on the board; 'D' moves our position down one row, if the position exists on the board; 'L' moves our position left one column, if the position exists on the board; 'R' moves our position right one column, if the position exists on the board; '!' adds the character board[r][c] at our current position (r, c) to the answer.  (Here, the only positions that exist on the board are positions with letters on them.) Return a sequence of moves that makes our answer equal to target in the minimum number of moves.  You may return any path that does so.  ",alphabet-board-path,Alphabet Board Path,"Hash Table, String",2
"Given a valid (IPv4) IP address, return a defanged version of that IP address. A defanged IP address replaces every period ""."" with ""[.]"".  ",defanging-an-ip-address,Defanging an IP Address,String,2
"Given the root of a Binary Search Tree (BST), convert it to a Greater Tree such that every key of the original BST is changed to the original key plus the sum of all keys greater than the original key in BST. As a reminder, a binary search tree is a tree that satisfies these constraints:  The left subtree of a node contains only nodes with keys less than the node's key. The right subtree of a node contains only nodes with keys greater than the node's key. Both the left and right subtrees must also be binary search trees.   ",binary-search-tree-to-greater-sum-tree,Binary Search Tree to Greater Sum Tree,"Tree, Depth-First Search, Binary Search Tree, Binary Tree",2
"You are given a series of video clips from a sporting event that lasted time seconds. These video clips can be overlapping with each other and have varying lengths. Each video clip is described by an array clips where clips[i] = [starti, endi] indicates that the ith clip started at starti and ended at endi. We can cut these clips into segments freely.  For example, a clip [0, 7] can be cut into segments [0, 1] + [1, 3] + [3, 7].  Return the minimum number of clips needed so that we can cut the clips into segments that cover the entire sporting event [0, time]. If the task is impossible, return -1.  ",video-stitching,Video Stitching,"Array, Dynamic Programming, Greedy",2
"You are given the root of a binary tree where each node has a value 0 or 1. Each root-to-leaf path represents a binary number starting with the most significant bit.  For example, if the path is 0 -> 1 -> 1 -> 0 -> 1, then this could represent 01101 in binary, which is 13.  For all leaves in the tree, consider the numbers represented by the path from the root to that leaf. Return the sum of these numbers. The test cases are generated so that the answer fits in a 32-bits integer.  ",sum-of-root-to-leaf-binary-numbers,Sum of Root To Leaf Binary Numbers,"Tree, Depth-First Search, Binary Tree",2
"Given a binary array nums and an integer k, return the maximum number of consecutive 1's in the array if you can flip at most k 0's.  ",max-consecutive-ones-iii,Max Consecutive Ones III,"Array, Binary Search, Sliding Window, Prefix Sum",2
"In a town, there are n people labeled from 1 to n. There is a rumor that one of these people is secretly the town judge. If the town judge exists, then:  The town judge trusts nobody. Everybody (except for the town judge) trusts the town judge. There is exactly one person that satisfies properties 1 and 2.  You are given an array trust where trust[i] = [ai, bi] representing that the person labeled ai trusts the person labeled bi. If a trust relationship does not exist in trust array, then such a trust relationship does not exist. Return the label of the town judge if the town judge exists and can be identified, or return -1 otherwise.  ",find-the-town-judge,Find the Town Judge,"Array, Hash Table, Graph",2
"You are given the root of a binary tree with n nodes where each node in the tree has node.val coins. There are n coins in total throughout the whole tree. In one move, we may choose two adjacent nodes and move one coin from one node to another. A move may be from parent to child, or from child to parent. Return the minimum number of moves required to make every node have exactly one coin.  ",distribute-coins-in-binary-tree,Distribute Coins in Binary Tree,"Tree, Depth-First Search, Binary Tree",2
"Given three integers x, y, and bound, return a list of all the powerful integers that have a value less than or equal to bound. An integer is powerful if it can be represented as xi + yj for some integers i >= 0 and j >= 0. You may return the answer in any order. In your answer, each value should occur at most once.  ",powerful-integers,Powerful Integers,"Hash Table, Math",2
"In an alien language, surprisingly, they also use English lowercase letters, but possibly in a different order. The order of the alphabet is some permutation of lowercase letters. Given a sequence of words written in the alien language, and the order of the alphabet, return true if and only if the given words are sorted lexicographically in this alien language.  ",verifying-an-alien-dictionary,Verifying an Alien Dictionary,"Array, Hash Table, String",2
"Given an array of integers arr, return true if and only if it is a valid mountain array. Recall that arr is a mountain array if and only if:  arr.length >= 3 There exists some i with 0 < i < arr.length - 1 such that: 	 arr[0] < arr[1] < ... < arr[i - 1] < arr[i]  arr[i] > arr[i + 1] > ... > arr[arr.length - 1]      ",valid-mountain-array,Valid Mountain Array,Array,2
"Given an integer array arr, and an integer target, return the number of tuples i, j, k such that i < j < k and arr[i] + arr[j] + arr[k] == target. As the answer can be very large, return it modulo 109 + 7.  ",3sum-with-multiplicity,3Sum With Multiplicity,"Array, Hash Table, Two Pointers, Sorting, Counting",2
"Given a string s, reverse the string according to the following rules:  All the characters that are not English letters remain in the same position. All the English letters (lowercase or uppercase) should be reversed.  Return s after reversing it.  ",reverse-only-letters,Reverse Only Letters,"Two Pointers, String",2
"An array is monotonic if it is either monotone increasing or monotone decreasing. An array nums is monotone increasing if for all i <= j, nums[i] <= nums[j]. An array nums is monotone decreasing if for all i <= j, nums[i] >= nums[j]. Given an integer array nums, return true if the given array is monotonic, or false otherwise.  ",monotonic-array,Monotonic Array,Array,2
"You are given an n x n grid where you have placed some 1 x 1 x 1 cubes. Each value v = grid[i][j] represents a tower of v cubes placed on top of cell (i, j). After placing these cubes, you have decided to glue any directly adjacent cubes to each other, forming several irregular 3D shapes. Return the total surface area of the resulting shapes. Note: The bottom face of each shape counts toward its surface area.  ",surface-area-of-3d-shapes,Surface Area of 3D Shapes,"Array, Math, Geometry, Matrix",2
"Alice and Bob have a different total number of candies. You are given two integer arrays aliceSizes and bobSizes where aliceSizes[i] is the number of candies of the ith box of candy that Alice has and bobSizes[j] is the number of candies of the jth box of candy that Bob has. Since they are friends, they would like to exchange one candy box each so that after the exchange, they both have the same total amount of candy. The total amount of candy a person has is the sum of the number of candies in each box they have. Return an integer array answer where answer[0] is the number of candies in the box that Alice must exchange, and answer[1] is the number of candies in the box that Bob must exchange. If there are multiple answers, you may return any one of them. It is guaranteed that at least one answer exists.  ",fair-candy-swap,Fair Candy Swap,"Array, Hash Table, Binary Search, Sorting",2
"You are given an encoded string s. To decode the string to a tape, the encoded string is read one character at a time and the following steps are taken:  If the character read is a letter, that letter is written onto the tape. If the character read is a digit d, the entire current tape is repeatedly written d - 1 more times in total.  Given an integer k, return the kth letter (1-indexed) in the decoded string.  ",decoded-string-at-index,Decoded String at Index,"String, Stack",2
"Alice and Bob play a game with piles of stones. There are an even number of piles arranged in a row, and each pile has a positive integer number of stones piles[i]. The objective of the game is to end with the most stones. The total number of stones across all the piles is odd, so there are no ties. Alice and Bob take turns, with Alice starting first. Each turn, a player takes the entire pile of stones either from the beginning or from the end of the row. This continues until there are no more piles left, at which point the person with the most stones wins. Assuming Alice and Bob play optimally, return true if Alice wins the game, or false if Bob wins.  ",stone-game,Stone Game,"Array, Math, Dynamic Programming, Game Theory",2
"Given a 2D integer array matrix, return the transpose of matrix. The transpose of a matrix is the matrix flipped over its main diagonal, switching the matrix's row and column indices.   ",transpose-matrix,Transpose Matrix,"Array, Matrix, Simulation",2
"You are given an m x n binary matrix grid. A move consists of choosing any row or column and toggling each value in that row or column (i.e., changing all 0's to 1's, and all 1's to 0's). Every row of the matrix is interpreted as a binary number, and the score of the matrix is the sum of these numbers. Return the highest possible score after making any number of moves (including zero moves).  ",score-after-flipping-matrix,Score After Flipping Matrix,"Array, Greedy, Bit Manipulation, Matrix",2
"Given an array of unique integers, arr, where each integer arr[i] is strictly greater than 1. We make a binary tree using these integers, and each number may be used for any number of times. Each non-leaf node's value should be equal to the product of the values of its children. Return the number of binary trees we can make. The answer may be too large so return the answer modulo 109 + 7.  ",binary-trees-with-factors,Binary Trees With Factors,"Array, Hash Table, Dynamic Programming",2
"A valid encoding of an array of words is any reference string s and array of indices indices such that:  words.length == indices.length The reference string s ends with the '#' character. For each index indices[i], the substring of s starting from indices[i] and up to (but not including) the next '#' character is equal to words[i].  Given an array of words, return the length of the shortest reference string s possible of any valid encoding of words.  ",short-encoding-of-words,Short Encoding of Words,"Array, Hash Table, String, Trie",2
"Given a string paragraph and a string array of the banned words banned, return the most frequent word that is not banned. It is guaranteed there is at least one word that is not banned, and that the answer is unique. The words in paragraph are case-insensitive and the answer should be returned in lowercase.  ",most-common-word,Most Common Word,"Hash Table, String, Counting",2
"There is a city composed of n x n blocks, where each block contains a single building shaped like a vertical square prism. You are given a 0-indexed n x n integer matrix grid where grid[r][c] represents the height of the building located in the block at row r and column c. A city's skyline is the outer contour formed by all the building when viewing the side of the city from a distance. The skyline from each cardinal direction north, east, south, and west may be different. We are allowed to increase the height of any number of buildings by any amount (the amount can be different per building). The height of a 0-height building can also be increased. However, increasing the height of a building should not affect the city's skyline from any cardinal direction. Return the maximum total sum that the height of the buildings can be increased by without changing the city's skyline from any cardinal direction.  ",max-increase-to-keep-city-skyline,Max Increase to Keep City Skyline,"Array, Greedy, Matrix",2
"We stack glasses in a pyramid, where the first row has 1 glass, the second row has 2 glasses, and so on until the 100th row.  Each glass holds one cup of champagne. Then, some champagne is poured into the first glass at the top.  When the topmost glass is full, any excess liquid poured will fall equally to the glass immediately to the left and right of it.  When those glasses become full, any excess champagne will fall equally to the left and right of those glasses, and so on.  (A glass at the bottom row has its excess champagne fall on the floor.) For example, after one cup of champagne is poured, the top most glass is full.  After two cups of champagne are poured, the two glasses on the second row are half full.  After three cups of champagne are poured, those two cups become full - there are 3 full glasses total now.  After four cups of champagne are poured, the third row has the middle glass half full, and the two outside glasses are a quarter full, as pictured below.  Now after pouring some non-negative integer cups of champagne, return how full the jth glass in the ith row is (both i and j are 0-indexed.)  ",champagne-tower,Champagne Tower,Dynamic Programming,2
"There is a forest with an unknown number of rabbits. We asked n rabbits ""How many rabbits have the same color as you?"" and collected the answers in an integer array answers where answers[i] is the answer of the ith rabbit. Given the array answers, return the minimum number of rabbits that could be in the forest.  ",rabbits-in-forest,Rabbits in Forest,"Array, Hash Table, Math, Greedy",2
"You are given an integer array arr of length n that represents a permutation of the integers in the range [0, n - 1]. We split arr into some number of chunks (i.e., partitions), and individually sort each chunk. After concatenating them, the result should equal the sorted array. Return the largest number of chunks we can make to sort the array.  ",max-chunks-to-make-sorted,Max Chunks To Make Sorted,"Array, Stack, Greedy, Sorting, Monotonic Stack",2
"You are stacking blocks to form a pyramid. Each block has a color, which is represented by a single letter. Each row of blocks contains one less block than the row beneath it and is centered on top. To make the pyramid aesthetically pleasing, there are only specific triangular patterns that are allowed. A triangular pattern consists of a single block stacked on top of two blocks. The patterns are given as a list of three-letter strings allowed, where the first two characters of a pattern represent the left and right bottom blocks respectively, and the third character is the top block.  For example, ""ABC"" represents a triangular pattern with a 'C' block stacked on top of an 'A' (left) and 'B' (right) block. Note that this is different from ""BAC"" where 'B' is on the left bottom and 'A' is on the right bottom.  You start with a bottom row of blocks bottom, given as a single string, that you must use as the base of the pyramid. Given bottom and allowed, return true if you can build the pyramid all the way to the top such that every triangular pattern in the pyramid is in allowed, or false otherwise.  ",pyramid-transition-matrix,Pyramid Transition Matrix,"Bit Manipulation, Depth-First Search, Breadth-First Search",2
"You are given an array of characters letters that is sorted in non-decreasing order, and a character target. There are at least two different characters in letters. Return the smallest character in letters that is lexicographically greater than target. If such a character does not exist, return the first character in letters.  ",find-smallest-letter-greater-than-target,Find Smallest Letter Greater Than Target,"Array, Binary Search",2
"A self-dividing number is a number that is divisible by every digit it contains.  For example, 128 is a self-dividing number because 128 % 1 == 0, 128 % 2 == 0, and 128 % 8 == 0.  A self-dividing number is not allowed to contain the digit zero. Given two integers left and right, return a list of all the self-dividing numbers in the range [left, right].  ",self-dividing-numbers,Self Dividing Numbers,Math,2
