Bucket Number,Bucket
199,"timeout, timeouts, timeout interval, timeout event, timeoutinterval, interval, event, interval timeout, timeout interval timeout, interval timeout event"
200,"playout, playout delay, talk spurt, spurt, playout time, packet talk spurt, packet talk, scheduled playout, scheduled playout time, talk"
201,"mac address, mac, adapter, address adapter, address, mac address adapter, address mac address, address mac, adapter mac, adapter mac address"
202,"wimax, mobile wimax, wimax network, known wimax, fixed wimax, wimax fixed, fact wimax, wimax collision, wimax collision course, collision course"
203,"source, destination, router advertisement, outgoing line, solicitation, source destination, destination network, routed source, routed source destination, packet routed source"
204,"data rate, rate, overhead, rate adaptation, adaptation, tion overhead, gross, overhead generated checked, checked start, generated checked"
205,"encoding, ascii, encoded, ascii character, require expensive hardware, decode message, encoding option, require expensive, instead encoding, expensive hardware"
206,"sequence number, window, sequence, number, sliding window, sliding, window protocol, range sequence number, range sequence, number respectively"
207,"downstream, upstream, mbps downstream, upstream downstream, downstream mbps, mbps downstream mbps, downstream mbps upstream, mbps upstream, downstream channel, mbps"
208,"sha, hash, hash algorithm, cryptographic hash, hash function, sha hash, cryptographic, function, sha developed, way hash"
209,"quality service, quality, service, based quality, based quality service, flow based quality, support quality, support quality service, class based, flow based"
210,"collision, probability collision, equal probability collision, collision chosen, chosen equal probability, collision chosen equal, collision collision, equal probability, chosen equal, probability collision chosen"
211,"mac address, mac, address field, address, contains mac, contains mac address, ap, address mac, mac address destination, wireless station"
212,"fsm, fsm description, description, fsm figure, state fsm, extended fsm, rdt, initial state fsm, fsm specification, initial state"
213,"frame, bit frame, bit, error, zero appended, frame zero appended, frame start end, frame zero, appended, frame start"
214,"vlr, hlr, visited network, visited, roaming, mobile user, location register, location, roaming number, mobile"
215,"authentication, authentication protocol, authorization, simple authentication, authentication authentication, mutual authentication, mutual, password, authenticate, authentication server"
216,"communication, communication possible, communicate, communication people, communicate communicate, sending communication possible, sending communication, communicate communicate communicate, communication possible sending, possible sending communication"
217,"spam, mail, spammer, junk, junk mail, spam email, mail spam, incoming mail, probably, likely spam"
218,"tcp, tcp implementation, tcp us, ip product, ha et, al tcp, mail order, ha et al, tcp ip product, et al tcp"
219,"forwarding, generalized forwarding, generalized, assured forwarding, assured, expedited forwarding, simple diffserv, simple diffserv network, section generalized forwarding, forwarding differ"
220,"access protocol, multiple access, multiple access protocol, random access, access, random access protocol, random, channel partitioning, multiple, partitioning"
221,"connection, connection establishment, establishment, establishing connection, assume connection, connection management, flow process, flow process process, data flow process, establishing"
222,"case, case case, consider case, case likely, case consider case, case consider, professional, consider, likely, hardwired manufacturer case"
223,"hot potato, potato, hot potato routing, potato routing, hot, route, bgp, routeselection algorithm, routeselection, bgp route"
224,"tcp ip, model, ip model, tcp ip model, osi, reference model, tcp ip reference, ip reference, ip reference model, reference"
225,"modem, cable modem, minislots, minislot, cmts, downstream channel, upstream, downstream, headend, cable"
226,"application buffer, client application, client application buffer, buffer, client, server sends bit, sends bit, time ttf client, time ttf, sends bit constant"
227,"web server, web, companion website, website, assignment, server, skeleton code, skeleton, companion, apache"
228,"audio, low, high low, audio http, audio application, low low, low medium, http traffic, low high, audio packet"
229,"envelope, body, smtp, header, email, message, email address, recipient, ascii, header message"
230,"label, flow label, path label, different label, label field, single label, set label, label switch, way network, removed"
231,"samplertt, estimatedrtt, samplertt value, value, rtt, devrtt, estimatedrtt samplertt, sample, fluctuation, sample rtt"
232,"consider figure, figure consider figure, consider figure consider, figure consider, consider, figure, learning feature nicely, insight consider, insight consider figure, learning feature"
233,"aloha, slotted aloha, slotted, efficiency slotted aloha, efficiency slotted, efficiency, pure, pure aloha, maximum efficiency, maximum efficiency pure"
234,"handoff, base station, base, station, handover, old base station, old base, cell, new base, new base station"
235,"ipv datagram, datagram format, ipv, ipv datagram format, datagram, format, version, section ipv datagram, section ipv, format ipv"
236,"attack, bad guy, guy, security, network security, bad, do attack, do, prevalent, network attack"
237,"xml, xhtml, html, language, xhtml basic, xslt, called xhtml, html defined, xml document, extensible"
238,"data sent, data transmitted, transmit data, data, transmit data sent, data soon, sender data, want send data, send data, want send"
239,"gsm, mobile phone, phone, europe, mobile, european, gsm global, gsm global mobile, deployed, global mobile"
240,"file, large file, file host, host sending, sending large file, sending large, host host, host, host tcp connection, file bit host"
241,"congested link, share, bandwidth, equal, share link, congested, link bandwidth, share link bandwidth, bandwidth congested link, equal share link"
242,"flooding, flood, link state update, state update, flooded, way setup, flooding requires, link state, router, write program"
243,"handshake, threeway, way handshake, threeway handshake, way, handshake let, handshake protocol, way handshake way, small tcp segment, small tcp"
244,"discus, discus discus, ter discus, tion discus, chapter discus, discus later ter, later ter discus, let discus, discus later, shortly discus"
245,"ad hoc, hoc, ad, ad hoc network, hoc network, manet, network ad, network ad hoc, network manet, mobile ad hoc"
246,"shortest path, shortest, path, compute shortest path, compute shortest, dijkstras, shortest path network, path network node, state state, dist"
247,"probability, slot, probability node, slot probability, node, slot node, probability given, node transmits, slot exactly node, node success"
248,"burst, burst error, burst length, error, burst error length, single burst, single burst error, length burst, error length, long burst"
249,"form, post, method, post method, input type, age, html, body, method post, html body"
250,"example let, example let look, let look, look example, let look example, let, look, example, simple example let, specific example let"
251,"host host, host, channel host, channel host host, host host request, host request, request channel host, suppose host, host suppose host, host request channel"
252,"message, message message, want reply message, want reply, reply field, encapsulated message, reply message, reply, encapsulated, message id"
253,"idle, channel idle, idle station, channel idle station, channel, sensed, channel sensed, station, channel sensed idle, sensed idle"
254,"public key, public, key, key ring, ring, key ring contains, ring contains, public key user, public key ring, key user"
255,"chip sequence, chip, sequence, chip sequence station, sequence station, station, orthogonal, transmit, transmit bit, station transmit"
256,"illustrated figure, illustrated, figure illustrated figure, figure illustrated, figure, illustrated figure illustrated, figure looking, broad picture, looking figure, illustrated figure looking"
257,"capacity receiver, sender, receiver, rate, sending rate, capacity, fast sender, send rate, network feeding, sending rate throughput"
258,"procedure, parameter, procedure described section, procedure described, pointer, described section, order information, iso adopting, mandated procedure certification, parameter command"
259,"door, socket, client, serversocket, knock door, client knock door, client knock, knock, data pass, client process"
260,"path, path length, path taken, path shown, path path, path run, path path change, multiple path equally, path shown suppose, path state"
261,"id, signaturebased, signature, snort, signaturebased id, signature database, new attack, database, attack, id system"
262,"toll, office, toll office, ixc, lata, lecs, ixcs, latas, switching office, office toll office"
263,"mtu, path mtu, mtu discovery, path mtu discovery, path, discovery, fragmented, path fragmentation, called path mtu, smaller mtu process"
264,"compression, decompressing, compression algorithm, later data, earlier data, decompressed, decompression, compression system, data decompressed, compressing data"
265,"osi, osi model, model, osi reference model, osi reference, reference model, model minus, heavily influenced, heavily influenced osi, influenced osi"
266,"option, choice, choose option, choose, long tail anderson, electronically get, get dick luck, standard usually, easiest getting, thing choose"
267,"ear, frequency, audibility, threshold audibility, hz, sound, db, threshold, masked, hz hz"
268,"token, ring, token ring, ring protocol, token ring protocol, called token, predefined, token station, token passing, bus"
269,"internet, internet internet, world internet, internetwork, internet application, internet information internet, material briefly, large nontrivial, mean internet, material briefly internet"
270,"bursty, traffic, burst, burst traffic, floyd leland, scale paxson, scale paxson floyd, traffic bursty burst, bursty burst, range time"
271,"delay, packetization, processing delay time, connected router connected, delay time required, packet, packetization delay, connected router, packet experience, delay time"
272,"error rate, bit error rate, bit error, error, wireless link, wired, wireless, error common, error common wireless, bit error common"
273,"base station, base, wireless host, wireless, host associated, station, wireless host associated, host associated base, associated base, associated base station"
274,"formula, infinity, approach infinity, formula let, formula let approach, let approach, let approach infinity, equation, dn, calculation"
275,"kbps, speech, uncompressed, voice, uncompressed voice, digitized, pcmencoded, human speech, kbps left, digitized speech"
276,"multipath, fading, multipath fading, path loss, multipath propagation, signal, faded, interference, called multipath fading, called multipath"
277,"bridge, lan, multidrop, join, multidrop lan, lan bridge, bridged lan, bridged, classic ethernet use, bridge developed classic"
278,"tcp ip, protocol tcp, tcp ip protocol, ip protocol, tcp, tcp protocol, tcpip, protocol, tcp internet, transmission control protocol"
279,"process, client process, process server, process client, client process server, server process, session pair, process client process, session pair process, communication session pair"
280,"traffic, traffic destined, destined, originates unit traffic, node originates, node originates unit, originates unit, unit traffic destined, traffic destined node, destined node"
281,"design, property, worked long huge, large nonetheless, thing designer design, today look, majority population people, large nonetheless capture, make design, make design feasible"
282,"distribution time, distribution, minimum distribution, minimum distribution time, minimum, specify distribution scheme, scheme distribution time, distribution scheme distribution, scheme distribution, distribution scheme"
283,"letter, plaintext, common letter, trigram, digram, th common, th common word, common, common word, english"
284,"node, frame node, transmitting frame node, transmitting frame, node wait, channel node, transmitting, transmission node, node begin, node transmit"
285,"wireshark, wireshark lab, lab, sniffer, packet sniffer, youll, lab youll, wireshark packet sniffer, screenshot, examines"
286,"section described, discussion, described section, section described section, order discussion, section, debate, described, discussion section, insight"
287,"method, method method, approach, niche let, method desirable practice, methods, method learned, method general, method general powerful, method technique widely"
288,"networking, student want, recommendation student want, recommendation student, career, want career, student want career, want career science, career science networking, career science"
289,"ond, ond strategy, ond requirement, onds, ond issue load, line onds, line onds ond, ond consideration process, mean needed, look different ond"
290,"encrypted, ek, plaintext, encrypting, intruder, message note, know key, plaintext message, message, decrypt"
291,"internet radio, radio, iptv, radio station, radio television, live, television, internet radio station, television station, broadcast"
292,"nonce, mics, nonce value, protocol us nonce, access point, us nonce, compute session, compute session key, use nonce, number protocol"
293,"sender figure, figure sender, figure receiver, figure, receiver figure, receiver, sender, figure sender receiver, figure sender figure, receiver shown figure"
294,"advantage, benefit, strategy advantage advantage, advantage advantage, advantage benefit, strategy advantage, advantage scheme, strategy, drawback, left quietly"
295,"router crash, crash, router, router discarded, havoc network, age, designated router, blown, havoc, discarded"
296,"integrity, message integrity, confidentiality, message integrity technique, problem message integrity, integrity technique, message, confidentiality integrity, message confidentiality, problem message"
297,"switch, connection switch, term bridge switch, switch interchangeably, bridge switch interchangeably, term bridge, look switch, connect switch, term, general term"
298,"nrz, manchester, manchester encoding, encoding, return zero, non return, non return zero, nrzi, photon, taken indicate sent"
299,"hop, time live, counter, time live field, live field, live, decremented, decremented hop, hop limit, reach zero"
300,"area, border router, border, area border router, area border, backbone, destination area, backbone router, router, router area"
301,"introduction introduction, introduction, introduction introduction introduction, introduction introduction medical, text schwartz provides, introduction better, understand let start, introduction busy, introduction busy introduction, introduction introduction appliance"
302,"router figure, fig router, router fig router, router fig, figure note, router, figure router, router figure note, router component, figure note router"
303,"analogy, analogy section, teacher student, clearer, teacher, introduced man, mail naturally, operation analogy, kid bicycle analogous, language worth"
304,"address block, ispsrus, block address, block, isp, address, organization, allocated, address allocated, address block ispsrus"
305,"army, blue army, blue, blue army attack, army attack, attack, army blue army, commander, army blue, white army"
306,"tsap, tsap address, portmapper, stable tsap address, stable tsap, attache tsap, tsap host, known tsap, attache, stable"
307,"social, social network, facebook, twitter, friend, online social, instagram twitter, facebook instagram twitter, facebook instagram, online social network"
308,"security, security mechanism, danger information, danger information leaking, security flaw, information leaking, leaking, concern, danger, flaw"
309,"sonet, carrier, sonet sdh, packet sonet, sdh, synchronous, sts, simply convenient container, situation packet sent, single channel independent"
310,"group, working group, working, divided working, committee, divided, divided working group, chairman, steering committee, steering"
311,"secure email, email, secure, pgp, email provides confidentiality, designing secure email, designing, designing secure, provides confidentiality, email provides"
312,"example example, example example example, example, exist course, flanagan numerous example, example example kleinrock, example example gave, example gave example, tobagi example example, example kleinrock tobagi"
313,"nsf, nsfnet, backbone, nsfnet backbone, an, supercomputer center, merit, commercial, supercomputer, regional network"
314,"analog, digital, digital transmission, adc, voltage, converter, acoustic wave, electrical voltage, analog signal, acoustic"
315,"switch, frame interface, filtering, forward frame, interface, frame switch, filtering forwarding, frame output buffer, frame host, forward"
316,"jpeg, image, subsequent image, redundancy, decoding, encoding, decoding jpeg, frame separately, frame separately jpeg, subsequent image exactly"
317,"beacon, sleep, ap, wake, beacon frame, buffered, buffered frame, frame node, node, ap buffer"
318,"key, whitening key, whitening, key key, key management, work follows key, key respect, respect key work, key work area, key work"
319,"ecn, congestion, explicit congestion notification, congestion notification, ece, explicit congestion, notification, explicit, ecn explicit congestion, ecn explicit"
320,"slot, tdm, time slot, frame tdm, slot frame, time slot frame, tdm slot, time slot user, slot revolving, revolving"
321,"gbn, gbn protocol, gbn sr, sr, gbn sr protocol, gobackn, sr protocol, errorrecovery mechanism, gobackn gbn, errorrecovery"
322,"distance vector routing, vector routing, vector, distance vector, distance, routing, routing distance vector, routing distance, routing algorithm, bellman ford"
323,"repeat, forever, line process, data point, process repeated, line, selective repeat, selective, repeated, determined"
324,"subtypes, subtype, type, subtype field, type subtype, zip, pdf, mixed, subtype allows, javascript zip"
325,"value value, value, recommended value, use value, recommended, play value, relates use global, variable absolute, value devrtt come, value value fourth"
326,"nr, seq, expected, frame expected, seq nr, frame, event, ack, frame send, void"
327,"ike, sa, ike sa, ipsec, ipsec sa, phase, ssl ike, exchange, internet key exchange, phase ike"
328,"routing protocol, intradomain, interas, interdomain, interas intraas, routing, intraas, intraas routing protocol, interdomain routing, interas intraas routing"
329,"ack, syn, syn ack, synack, ack segment, return ack segment, return ack, ack corresponds, client return ack, allocated resource"
330,"execute, program, executable program, executable, program running, routine, process, probably dont, machine asking trouble, machine asking"
331,"bridge, hash table, manual configuration, inside bridge, treatment bridge, manual, perlman, transparent, treatment, hash"
332,"file transfer, throughput file, throughput file transfer, throughput, transfer, file, transfer server client, file transfer server, transfer server, server client"
333,"work, work work, job work, privilege guess paul, work rest want, work thing work, want watch work, work reported serjantov, work pay, work pay privilege"
334,"connectionless, connection oriented, oriented, connectionless service, connectionless network, oriented service, connection oriented service, layer connection oriented, network service, service"
335,"transmission, transmission method, pin, base station, way headend user, subscriber rigidly, technique briefly transmission, identical action, last transmission, station utilizes time"
336,"proxy, proxy proxy, cleartext, web site, proxy server, proxy server proxy, web proxy user, proxy user, proxy pool, site"
337,"cocktail party, party, cocktail, partygoer, talking, speak, analogy, partygoer speak, cocktail party analogy, party analogy"
338,"reorder, order sent, reorder message, corrupt, channel, delivered order sent, corrupt reorder, corrupt reorder message, wire like, reorder packet"
339,"suppose, xr suppose, xr, suppose ususuunn suppose, xr suppose xr, suppose suppose, suppose usndmin, suppose ususuunn, suppose usndmin suppose, suppose xr"
340,"switch figure, switch table, uppermost switch figure, uppermost switch, uppermost, figure switch, switch, figure switch table, switch table uppermost, table uppermost"
341,"wep, equivalent privacy, wired equivalent, wired equivalent privacy, stubblefield, equivalent, wep wired equivalent, wep wired, wired, privacy"
342,"network core, core, edge, network edge, edge network, end system, edge network core, network network core, network edge network, core network"
343,"security, security service, security functionality, provide security, functionality, enjoy security service, enjoy security, blanket coverage, security provided, blanket"
344,"audio, audio video, video, sound, soundtrack, audio channel, moving picture, film, profile, video audio"
345,"network performance, performance, measurement, measuring, network performance measurement, performance measurement, measure network performance, measurement network, network measurement, measure network"
346,"kbps, ran, kbps kbps, bit kbps, older, mbps better low, kbps worth, kbps monaural, kbps mbps kbps, kbps limit situation"
347,"receive receive, sent, sent faster version, sent perth complete, sent sent server, server sent faster, sent instead, sent received received, sent faster, sent email sent"
348,"information, information information, hope information, hope information need, davie, information theory, information need, perkins, hope, kind anderson stuttard"
349,"diffserv, phb, diffserv architecture, marking, diffservcapable, behavior, perhop behavior, edge, perhop, classification"
350,"window, window update, update, sends window update, sends window, called window, window management tcp, window management, management tcp, window size"
351,"tree, zebra, tree tree, search begin, term standard, tree zebra, tree zebra tree, tree search begin, tree search, zebra tree"
352,"capacity, capacity megabit, increase capacity, demand, megabit, pipe, filled capacity, practice hard generalize, follows possible increase, frame follows possible"
353,"discussed section, discussed section discussed, section discussed section, section discussed, discussed, section, dash discussed, dash discussed section, dash, wfq"
354,"pp, peer, file, distributing file, pp file, distributing, pp file sharing, file sharing, architecture, consider distributing file"
355,"answer, following question, answer following question, answer following, question, following question answer, question answer, answer question, following, question briefly"
356,"fec, forward error correction, forward error, interleaving, fec interleaving, interleaving fec, error correction, correction, fec interleaving fec, correction fec"
357,"protocol shown, fig protocol, protocol shown figure, protocol shown fig, fig figure, fig, protocol fig, protocol, diagram, protocol protocol"
358,"sequence number, sequence, sequence number frame, number frame, frame, frame sequence, number, number checked, remembers sequence number, remembers sequence"
359,"networking, design, network designer, innovation, change, network crucial component, networking continues, networking dessert, networking dessert technical, involved network design"
360,"content, content distribution, content distribution network, distribution network, distribution, content provider, contentprovider network, replicated content, build content distribution, contentprovider"
361,"stopandwait, stop wait, wait protocol, wait, stop wait protocol, utilization, stop, stopandwait protocol, utilization sender, sender allowed"
362,"code, advanced code, simple code, block code, balanced, codewords, codeword, advanced, us coding run, general case codewords"
363,"udp, socket programming, clientserver application, udp client, clientserver, socket, udpserver, needed socket, clientserver application udp, programming"
364,"acknowledgement, receipt, end acknowledgement, end end acknowledgement, called cumulative, called cumulative acknowledgement, acknowledged, cumulative acknowledgement, cumulative, correctly received"
365,"joe, florida, orlando, gas station, drive, gas, lakeside, lakeside drive, tell joe, attendant"
366,"true false, true, false, true false true, false true false, false true, true true, false problem, false general true, false general"
367,"station, transmits frame, frame, station transmits frame, station transmits, frame station, transmitting frame, frame containing, transmits, numerical order fig"
368,"ethernet frame, ethernet, frame ethernet, frame ethernet frame, baset, frame structure, frame, ethernet frame shown, ethernet frame structure, mac protocol frame"
369,"mime type, mime, type, existing association, cs, display, type application, type browser, helper application, browser"
370,"packet lifetime, lifetime, maximum packet lifetime, maximum packet, maximum, packet lifetime maximum, lifetime maximum, lifetime maximum packet, packet live, onds"
371,"mobility, nomadic, situation laptop, gain access, situation, gain, network mobility design, need provide mobility, nomadic computing refers, moving network let"
372,"voice, voice data, digital voice, data traffic, voice ip, digitized, voice call, ip internet telephony, voice digital voice, voice ip internet"
