Bucket Number,Bucket
-1,"network, packet, time, link, data, bit, tcp, router, connection, layer"
0,"fiber, cable, twisted, twisted pair, modem, pair, copper, adsl, optical, wire"
1,"dns, dns server, domain, query, record, server, edu, hostname, com, authoritative"
2,"mail, mail server, user agent, email, smtp, agent, transfer, folder, mailbox, user"
3,"cipher, ciphertext, block, encryption, plaintext, key, decryption, block cipher, de, aes"
4,"fig, shown fig, fig example, shown, example fig, listed fig, illustrated fig, illustrated, listed, fig shown"
5,"page, browser, web page, web, plug, url, display, plug in, in, html"
6,"ack, retransmit, duplicate, retransmission, lost, segment, acks, timeout, retransmissions, duplicate acks"
7,"isps, isp, tier, access isps, tier isps, regional, provider, global transit, access isp, backbone"
8,"band, ghz, frequency, spectrum, mhz, frequency band, spread, spread spectrum, ism, ism band"
9,"alice, bob, trudy, message alice, alice bob, message, talking, alice sends, message bob, suppose alice"
10,"telephone, telephone network, telephone company, company, office, bell, end office, call, switched telephone, voice"
11,"sdn, controller, plane, control plane, sdn controller, control, openflow, sdn control, opendaylight, networkcontrol"
12,"agent, foreign, home agent, mobile node, foreign agent, mobile, coa, home, foreign network, node"
13,"copyright, privacy, law, court, dmca, government, copyrighted, people, music, citizen"
14,"byte, length, header, field, length field, variable length, field byte, payload, header byte, option"
15,"cache, caching, web cache, cached, proxy, object, web, cached copy, browser, copy"
16,"protocol, new protocol, protocol protocol, protocol work, protocol simple, protocol handle, problem protocol, use protocol, network protocol, protocol word"
17,"satellite, earth, communication satellite, orbit, communication, altitude, ground, orbit satellite, leo, satellite satellite"
18,"reliable, reliable data, data transfer, reliable data transfer, transfer, service, provides reliable, unreliable, delivery, data transfer service"
19,"important, detail, subtle, subtle important, simplicity, distinction, practice, important subtlety, practice important, unfortunately"
20,"rfid, tag, reader, rfid tag, rfid reader, epc, backscatter, identifier, reader tag, gen"
21,"mbps, gbps, mbps link, rate mbps, mbps mbps, rate, link, link mbps, oc, data rate"
22,"cdn, cdn node, cdns, cluster, content, sydney, cdn server, akamai, node, ldns"
23,"sip, invite, invite message, registrar, sip message, proxy, bob, yes, sends invite message, sip device"
24,"header, header line, line, response, request message, http, message, response message, mime, http message"
25,"datagram, datagrams, ipv datagram, datagram host, ipv, destination, ip datagram, send datagram, nat router, ip"
26,"bucket, token, token bucket, leaky, leaky bucket, water, burst, rate, policer, bucket policer"
27,"ethernet, classic ethernet, ethernet ethernet, classic, switched ethernet, switched, fddi, ethernet card, lan, technology"
28,"udp, tcp udp, udp tcp, protocol udp, connectionless, transport protocol, transport protocol udp, transport, udp internet, tcp"
29,"mpeg, compression, video, audio, mp, video compression, compress, quality, mpeg standard, mpeg mpeg"
30,"rfc, rfcs, defined rfc, rfc rfc, described rfc, defined, described, rfc rfc rfc, described rfcs, implementation"
31,"subnet, subnets, subnet address, mask, subnet mask, prefix, support interface, address form, interface, interface subnet"
32,"output port, port, input port, fabric, output, input, switching fabric, switching, port output port, port output"
33,"ip address, ip, address, ip addressing, host ip address, host ip, host, address ip, host network, ip address ip"
34,"firewall, filter, stateful, packet filter, control list, access control list, organization, rule, access control, stateful filter"
35,"ssl, ssl record, record, tl, version ssl, ssl protocol, socket layer, ure, layer ssl, almostssl"
36,"key, bob, alice, public key, public, bob public, bob public key, session key, private key, encrypted"
37,"signature, digital signature, signed, digital, hash, document, private key, signed document, key, verifiable"
38,"parity, error, bit error, parity bit, bit, single bit error, single bit, row, detect, error occurred"
39,"web, site, world wide web, wide web, search, world wide, popular, unpopular, netscape, world"
40,"urity, web urity, url, urity urity, uris, urity problem, issue, uniform resource, urity web urity, internet urity"
41,"multicast, group, multicasting, anycast, multicast routing, tree, member, multicast address, spanning tree, multicast spanning tree"
42,"university, engineering, science, professor, mit, electrical engineering, inspired, professionally, inspired professionally, phd"
43,"skype, voice, video, conference, voice video, conversational, conferencing, video conference, call, voip"
44,"radio, microwave, interference, antenna, range, radio wave, range radio, microwave oven, oven, wave"
45,"arp, arp query, arp table, mac address, mac, address arp, arp module, arp packet, arp cache, address"
46,"congestion, congestion control, control, congestion control algorithm, control algorithm, congestion network, multiplicative, additive, decrease, congestion control mechanism"
47,"congestion window, window, slow start, slow, congestion, cwnd, window size, ms, start, threshold"
48,"data link, data link layer, link layer, frame, layer, link, network layer, frame arrives, linklayer, layer frame"
49,"data center, center, data, data center network, center network, cloud, google, container, greenberg, internet data center"
50,"network layer network, layer network layer, layer network, network layer, layer, network, network network layer, network network, task, layer layer"
51,"fragment, fragmentation, reassembly, fragment fragment, offset, fragmentation reassembly, packet fragment, fragment packet, multiple fragment, offset field"
52,"cdma, cdma code, code division, code division multiple, division multiple access, division multiple, code, umts, division, access cdma"
53,"playout, video, block, freezing, client, consumption rate, prefetching, begin playout, consumption, continuous playout"
54,"html, style, title, sheet, style sheet, tag, text, br, href, head"
55,"service, transport, transport service, layer, layer service, transport layer, network layer, layer provides, service layer, service network"
56,"successor, node, finger, finger table, predecessor, node identifier, successor node, identifier, circle, node node"
57,"section section, section section section, section, noted section additional, section shortly, section value, contains helpful record, different section section, contains helpful, section want review"
58,"distance vector, neighbor, vector, distance, dv, distancevector, dv algorithm, update, node, new distance vector"
59,"rtp, rtsp, rtcp, rtp packet, udp, rtp header, protocol rtp, real time, rtsp command, rtp rtp"
60,"frame, frame length, column, us column, frame frame, format data, sonet frame, frame format, frame shown, vt us"
61,"fdm, multiplexing, division, division multiplexing, frequency division, tdm, frequency division multiplexing, ofdm, frequency, fdm tdm"
62,"blah, iv blah blah, iv blah, fine iv blah, fine iv, blah mod, blah blah mod, blah blah, fine, iv"
63,"technology, industry, growth, innovation, company, technical, history, economic, century, economic growth"
64,"example figure, figure, figure example figure, figure example, example figure example, figure consider, example, refer figure, figure refer, refer"
65,"snr, modulation, noise, ratio, qam, ber, noise ratio, db, signal noise ratio, signal noise"
66,"certificate, ca, revoked, ra, root, revocation, approved, certificate revoked, revoked certificate, ca ca"
67,"header, ip header, ipv, ipv header, field, header field, option, header ipv, option field, field ip"
68,"wireless, wireless network, wireless link, network wireless, wireless network wireless, type wireless network, wifi, type wireless, wireless hop, wireless communication"
69,"clock, get sends, sends get sends, sends get, get sends get, tick, get, clock tick, current time, counter"
70,"network network, network network network, network, cw net, cw, ee network, consider network shown, consider network, net, class network"
71,"transportlayer segment, transportlayer, segment, transport layer, layer, network layer, segment transport, datagram, datagrams, transport"
72,"window, window size, sliding window, sliding, size, sliding window protocol, window protocol, receiver window, sender, receiver"
73,"ipv, ipv ipv, ipv address, ip version, version ip, ipv bit, ipv protocol, adoption, bit ipv, version"
74,"bgp, ebgp, ibgp, gateway, gateway router, bgp routing, gateway protocol, ebgp connection, ibgp connection, policy"
75,"bank, credit, credit card, card, credit card number, card number, account, customer, gold, money"
76,"ospf, routing, routing protocol, linkstate, ospf routing, protocol ospf, routing algorithm, weight, link weight, ospf bgp"
77,"lan, lan lan, lan lan lan, lan figure, building, switched lan, soho, lan host, single, switched lan figure"
78,"mobile, mobile host, mobile ip, mobile node, indirect, foreign network, indirect routing, foreign, correspondent, routing mobile"
79,"application layer, layer application, application layer application, layer application layer, application, layer, application layer contains, network layer application, layer contains, layer proceeding"
80,"propagation, propagation delay, delay, propagation speed, transmission delay, speed, transmission, packet length, transmission rate, distance router"
81,"standard, international, standardization, iso, international standard, standard standard, itu, standard organization, organization, wear"
82,"collision, detect collision, collide, node, collision node, colliding, involved collision, detects collision, slot, detect"
83,"figure figure, figure figure figure, figure, figure let figure, figure iv figure, figure figure nonetheless, figure figure let, figure figure iv, figure nonetheless figure, figure iv"
84,"transport layer, transport layer transport, layer transport, transport, layer transport layer, layer, transfer person, bag accomplished, layer transfer person, layer transfer"
85,"delay, average, estimate, average delay, internet delay, delay delay, delay let, total delay, total, estimate average"
86,"network urity, urity, urity network, urity network urity, network urity network, network, casual network urity, making network ure, casual network, ure"
87,"network fig, network shown, graph, network figure, consider network, figure, fig, wan, consider, network shown figure"
88,"send packet, packet, packet sends packet, packet sends, sends packet sends, sends packet, send, sending packet, packet host, description packet format"
89,"netflix, cdn, video, kankan, amazon, movie, streaming, amazon cloud, netflix video, netflix youtube"
90,"figure shown figure, figure shown, shown figure shown, shown figure, shown, figure, indicated figure shown, manner shown figure, manner shown, instead shown figure"
91,"xor, mod, arithmetic, modulo, remainder, modular arithmetic, fi, modular, pseudorandom sequence, pseudorandom"
92,"rtt, rtts, congestion window, increase, ms rtt, time rtt, window, ms, wrtt, rtt congestion"
93,"rdt, protocol rdt, rdt protocol, rdtsend, rdtsenddata, data transfer, reliable data transfer, reliable data, rdtrcv, reliable"
94,"lost, duplicate, lost packet, packet lost, duplicate packet, packet, delayed, delayed duplicate, rtt packet, client lost"
95,"streaming, medium, stored, video, stored medium, streaming stored, http streaming, streaming stored medium, live, streaming video"
96,"bluetooth, bluetooth bluetooth, bluetooth protocol, bluetooth network, radio layer, bluetooth device, device, slave, master, version bluetooth"
97,"dhcp, dhcp server, dhcp discover, dhcp client, lease, discover message, discover, dhcp request message, address dhcp, ip address"
98,"mpls, mpls header, mpls network, ip packet, ip, network mpls, mplscapable, ip device, header, router mpls"
99,"bittorrent, torrent, peer, tracker, cohen, swarm, chunk, peer peer, chunk peer, file distribution"
100,"nonpersistent, persistent, persistent connection, parallel, request, connection, nonpersistent http, http, parallel connection, nonpersistent connection"
101,"vlan, vlans, vlan aware, switch, vlan switch, aware, port, port belong, switch port, trunk"
102,"flag, flag byte, stuffing, byte, bit stuffing, byte stuffing, escape byte, escape, byte flag, byte flag byte"
103,"ap, aps, wireless device, beacon, beacon frame, associate, device, wireless, association, ssid"
104,"wfq, priority, robin, round robin, queueing, queue, class, weighted fair, discipline, weighted"
105,"year, tom, tenure, government, wilson, candidate, tenure year, tom wilson, year wilson, wilson candidate"
106,"flow, bandwidth, fairness, max min, min, allocation, bandwidth flow, bandwidth reserved, flow flow, max"
107,"al, et al, et, clark, et al example, al example, saltzer et, saltzer et al, saltzer, al information"
108,"algorithm, nagle, converge, offered reward break, red algorithm, offered reward, right point, sophisticated algorithm, reward break, red"
109,"ipsec, ipsec datagram, datagram, esp, sa, esp protocol, headquarters, payload, entity, payload ipsec"
110,"hamming, code, convolutional, reed, solomon, reed solomon, convolutional code, error, hamming distance, solomon code"
111,"port, port number, port reserved, number, reserved, port port, server port, server port number, called port, inetd"
112,"cookie, amazon, susans, cookie header, susan, cart, cookie containing, identification number, setcookie, cookie file"
113,"solution, problem, solve, problem problem, previous problem, problem interesting, solution consider, solution solution, solution chosen, problem approach"
114,"nat, nat box, box, translation, address translation, address, ip address, problem nat, host nat, nats"
115,"voip, voice ip, voice, voip application, voip example, peer peer traffic, peer traffic, voice ip packet, application voip, traffic voip"
116,"address, address space, address address, space, postal address, address field, postal, addressing, careof address, careof"
117,"virtual circuit, virtual, circuit, virtual circuit network, circuit network, circuit set, vc, network virtual circuit, circuit number, datagram network"
118,"segment, lost segment, segment arrive, suppose segment, segment lost, lost, segment segment, segment contains, segment acknowledgment, segment acknowledged"
119,"sequence number, sequence, bit sequence number, number, bit sequence, sequence number field, number field, range sequence number, range sequence, field"
120,"bandwidth, network bandwidth, bandwidth efficiently, higher class, version want watch, watch function, bandwidth approach, current available, function current available, current available bandwidth"
121,"queuing delay, queuing, delay, queueing, queue, queueing delay, arrival rate, queuing delay packet, arrival, traffic intensity"
122,"alice isp, alice, isp, bob, bob ip address, bob ip, ip address, dns, server alice, trudy"
123,"service, class service, besteffort, class, besteffort service, type service, differentiated service, differentiated, different class, service class"
124,"checksum, sum, complement, internet checksum, complement sum, checksum algorithm, complement arithmetic, computed, checksum computed, one complement"
125,"rsa, rsa algorithm, algorithm, public key, rsa work, public, key algorithm, public key algorithm, key cryptography, key"
126,"faster, efficiency, performance, improve performance, improve performance improve, performance improve, fixed determine, performance improve performance, determine efficiency, massively"
127,"csma, csma cd, cd, collision, csma collision, csma ca, persistent csma, persistent, csma cd protocol, csma cd algorithm"
128,"source port, port, port number, source port number, source, destination port, destination port number, nmap, source destination port, ip address port"
129,"physical layer, physical, layer physical layer, layer physical, physical layer physical, layer, link layer physical, layer machine, applied, framing"
130,"router, router router, natenabled, natenabled router, router gateway, free zone, cost router router, default free zone, router router cost, cost router"
131,"access control sublayer, control sublayer, medium access control, medium access, sublayer, access control, control sublayer medium, sublayer medium, sublayer medium access, medium"
132,"congestion control, tcp congestion control, congestion, tcp congestion, control, congestion control tcp, tcp, control tcp, tcp implement, avoidance fast"
133,"quantization, sample, quantized, dct, bit sample, coefficient, sampling, analog, signal sampled, analog audio"
134,"data link, data link layer, link layer data, link layer, layer data link, layer data, link, layer, data, data link network"
135,"sequence number, initial sequence number, initial sequence, sequence, initial, number, segment, sequence number field, tcp sequence, segment containing"
136,"wireless lan, lan, wireless, ieee, standard wireless lan, lan wireless lan, standard wireless, lan wireless, ieee wireless, wireless lan standard"
137,"http, http protocol, hypertext transfer protocol, hypertext transfer, protocol http, http hypertext transfer, web, http hypertext, hypertext, transfer protocol"
138,"flow table, flow table entry, table, flow, table entry, entry, action, controller, match, matchplusaction"
139,"stack, protocol stack, protocol, layer protocol stack, stack protocol, protocol stack protocol, layer protocol, protocol protocol stack, stack layer, architecture protocol stack"
140,"acknowledgement, acknowledgement frame, frame, frame received, frame acknowledgement, piggybacked acknowledgement, received acknowledged, lost, frame get, bearing"
141,"routing algorithm, routing, algorithm, way classify routing, way classify, classify routing algorithm, routing algorithm according, algorithm according, classify routing, centralized routing"
142,"urity, encryption, encrypted, encrypt, urity mechanism, network urity, ure, end end, layer encryption, encryption urity mechanism"
143,"jitter, called jitter, network jitter, delay jitter, high jitter, networkinduced, low jitter, delay, networkinduced packet, reduce jitter"
144,"base station, base, station, cell, cell base, cell base station, mobile, base transceiver station, base transceiver, transceiver station"
145,"php, javascript, script, cgi, language, vbscript, jsp, php script, html, cgi script"
146,"prefix, longest, matching, longest prefix, longest matching, matching prefix, longest prefix matching, longest matching prefix, prefix matching, forwarding table"
147,"step, figure step, shown step, step step, step shown, step figure, step illustrated figure, illustrated figure step, step illustrated, shown figure step"
148,"hub, hub switch, switch, switch hub, hub hub, repeater hub, repeater, pair hub, router gateway, twisted pair"
149,"buffer, buffer size, buffering, buffer management, sized buffer, size, sized, variable sized buffer, large circular, circular buffer"
150,"authentication server, authentication, ap, wireless client, protocol ap, authentication protocol ap, ap authentication, access point, eap, client ap"
151,"release, released, connection, connection released, releasing connection, releasing, release connection, disconnect, symmetric release, symmetric"
152,"applet, activex, java, activex control, java applet, jvm, interpreter, applet interpreted, applet trusted, javascript"
153,"telnet, telnet session, telnet connection, gateway, external host, internal user, application gateway, character, initiate telnet, remote"
154,"cellular, cellular network, lte, network architecture, gsm, architecture, lte long, term evolution, long term evolution, lte long term"
155,"ieee, acm, standard ieee, ieee ieee, ieee standard, standard, ieee acm, aspect ieee, ieee standard ieee, approved ieee"
156,"icmp, icmp message, ping, echo, icmp message type, ccmp, icmp echo, use icmp, message type, icmp ping"
157,"arpanet, arpa, robert, research, project, connected arpanet, original arpanet, dod, arpanet design, arpanet early"
158,"sender, sends message, sends message sends, message sends message, message, deliver message, message sends, message deliver, example want send, example want"
159,"qos, guarantee, qos guarantee, flow, resource, qos requirement, admission, perconnection qos, requirement, quality service"
160,"book, chapter, author, reference, edney, interchangeably, encourage, term, use term, reader"
161,"cost, link cost, cost change, link, link cost change, dyx, cost link, link cost increase, cost increase, higher cost"
162,"virus, malware, worm, malicious, infect, selfreplicating, virus worm, attachment, mobile code, executable"
163,"msc, anchor msc, visited, anchor, visited msc, mobile, msc visited, home msc, msc anchor, msc anchor msc"
164,"queue, queued, queue packet, transmission packet, packet, packet queue, transmitted, packet transmitted, end queue, packet currently transmitted"
165,"checksum, pseudoheader, udp, header, internet checksum, checksum computed, computed, header checksum, udp checksum, checksum header"
166,"tree, spanning tree, spanning, sink, sink tree, group, pruned, tree router, spanning tree use, spanning tree leftmost"
167,"forwarding table, forwarding, table, router forwarding table, router forwarding, forwarding table router, table router, link interface, entry, router"
168,"syn, syn segment, segment, syn flood, segment client, client tcp, flood, tcp, special tcp segment, special tcp"
169,"traceroute, traceroute program, traceroutes, trace, program, www traceroute, trace route, traceroute org, traceroute source, www traceroute org"
170,"dtn, bundle, dtn node, dtns, bundle dtn node, bundle dtn, dtn architecture, storage, collection point, working"
171,"sequence number, sequence, packet sequence, packet sequence number, number, packet sent, duplicate, sent packet sequence, nextseqnum, packet"
172,"request, request reply, response, response message, reply, http, http response message, backtoback, client, request message"
173,"snmp, managing, managing server, managed device, snmpv, managed, mib, pdu, network management, simple network management"
174,"tion, tions, following tions, tion look, tion tion, later tion, look, following, tion study, examine"
175,"transportlayer protocol, transport protocol, transportlayer, transport, protocol provides, protocol, provides logical, element transport protocol, element transport, transport layer"
176,"mobile web, mobile, web, mobile device, desktop, device, content, smartphone, mobile web content, mobile web web"
177,"interconnected, collection, network network, internet, internetworks, internetwork, connected internet, internet connected, structure, connected"
178,"section recall, recall, recall section, recall section recall, section recall section, section, recall discussion, section recall discussion, figure recall, figure recall section"
179,"switching, circuit switching, packet switching, circuit, switching packet, switching packet switching, circuit switching packet, switching circuit switching, switching circuit, packet switching versus"
180,"pixel, color, image, rgb, pixel pixel, bit pixel, eye, green, green blue, red green"
181,"channel, signaling, channel allocation, signaling channel, allocation, use channel, allocation problem, single channel, channel channel, characteristic broadcast"
182,"udpclient, py, serverport, clientsocket, serversocket, socket, udpserver, bind, udpclient py, tcpclient"
183,"gigabit, gigabit ethernet, ethernet, fast ethernet, mbps, fast, ethernet standard, compatibility, base ethernet, installed base"
184,"ct, rts, rts ct, ct frame, rts ct frame, rts frame, frame, frame rts, frame rts ct, ack frame"
185,"timer, tick, timer expires, reset, expire, timer set, expires, timer management, list, expiration"
186,"table, column table, column, note table, shown table, lookup, table shown table, numbered starting, table arrow, second column table"
187,"input bit, output bit, bit output, output, bit, input, bit input, mapped, group bit, bit output bit"
188,"client server, client, client code, clientserver application, look client, code client, client server model, client server program, server model, code"
189,"tunnel, tunneling, ipv, paris, london, multiprotocol router, multiprotocol, ipv packet, router ipv, paris london"
190,"ppp, aal, ppp frame, sonet, protocol ppp, hdlc, pointtopoint, frame format, payload, ppp framing"
191,"crc, crc code, polynomial, cyclic redundancy check, redundancy check, cyclic redundancy, cyclic, crc byte, standard crc, crc bit"
192,"vpn, private network, virtual private, virtual private network, vpns, private, virtual, public internet, vpns virtual private, vpns virtual"
193,"procedure, stub, server procedure, remote procedure, client stub, procedure client, server stub, called procedure, remote, calling"
194,"tcp sender, loss, rate, congestion, loss rate, packet loss, tcp, sender, congestion path, sender decrease"
195,"switch, linklayer switch, packet switch, linklayer, router linklayer switch, router linklayer, switch router, implement layer, tier switch, router"
196,"country, france, boston ma, sept, white plain, ma, florida, state state, boston, plain"
197,"station, suppose station, numbered station, transmitting station, hearreceive, station transmitting station, transmits hearreceive, transmitting, numbered, station transmitting"
198,"bridge, frame port, port, port bridge, frame bridge, frame, bridge frame, frame sent port, frame port output, output port bridge"
