Topics,Description,Keywords
Introduction to Computer Networks,"This topic covers the fundamental concepts and principles of computer networking, including the basics of data communication, networking history, and the importance of networks in the modern world","Networking fundamentals, data communication, history of networks"
Network Models and Protocols,"This topic explores various network models and communication protocols, such as the OSI model and the TCP/IP suite, which serve as the foundation for understanding how data is transmitted across networks","OSI model, TCP/IP suite, communication protocols"
Network Topologies and Architectures,"Network topologies refer to the physical and logical arrangements of network components. This topic discusses different topologies like star, bus, and mesh, as well as network architectures like client-server and peer-to-peer","Network topologies, physical architecture, logical architecture"
Network Devices and Hardware,"This topic focuses on the hardware components used in networking, including routers, switches, hubs, and various network devices that facilitate data transmission. Keywords: Network devices, hardware components","Network devices, hardware components"
Network Layers and the OSI Model,"The OSI model is divided into seven layers, each serving a specific purpose in the network communication process. This topic explains the functions of each layer and their interactions","OSI layers, network communication"
TCP/IP Protocol Suite,"TCP/IP is a set of protocols that underpin the modern internet. This topic delves into the details of these protocols, such as TCP, IP, UDP, and ICMP","TCP/IP protocols, internet protocols"
IP Addressing and Subnetting,"IP addressing is fundamental to network communication. This topic covers IPv4 and IPv6 addressing, subnetting, and the allocation of IP addresses","IP addressing, subnetting, IPv4, IPv6"
DNS (Domain Name System),"DNS is responsible for translating domain names into IP addresses. This topic discusses how DNS works, its importance, and its role in internet navigation","Domain Name System, DNS resolution"
Ethernet and LAN Technologies,"Ethernet is a widely used LAN technology. This topic explores Ethernet standards, LAN technologies, and their applications in local networks","Ethernet standards, LAN technologies"
Wireless Networking,"This topic focuses on wireless communication, including Wi-Fi, cellular networks, and wireless protocols like Bluetooth. It also discusses wireless security","Wireless communication, Wi-Fi, wireless security"
Network Security and Threats,"This topic explores the strategies, technologies, and best practices for safeguarding networks against unauthorized access, data breaches, and various cyber threats","Network security, cybersecurity, threat mitigation"
Firewall and Intrusion Detection Systems,"Firewalls and intrusion detection systems are critical network security components. This topic covers their functions, types, and their roles in protecting networks","Firewalls, intrusion detection, security measures"
VPN (Virtual Private Network),"VPNs enable secure communication over public networks. This topic explains how VPNs work, their types (e.g., site-to-site, remote access), and their importance in ensuring privacy","Virtual Private Network, secure communication"
Network Routing and Switching,"Routing and switching are key components of network infrastructure. This topic discusses routing protocols, switching techniques, and their roles in data forwarding","Routing protocols, switching, data forwarding"
VLANs (Virtual LANs),"VLANs segment networks into virtual LANs for improved network management and security. This topic covers VLAN configuration, benefits, and use cases","Virtual LANs, network segmentation"
Network Management and Troubleshooting,"Effective network management ensures optimal network performance. This topic explores network monitoring, troubleshooting techniques, and management tools","Network management, troubleshooting, monitoring tools"
Quality of Service (QoS),"QoS mechanisms prioritize network traffic to ensure high-quality service. This topic discusses QoS techniques, such as traffic shaping and prioritization","Quality of Service, traffic prioritization"
Cloud Computing and Networking,"computing is transforming network architecture. This topic covers cloud service models (IaaS, PaaS, SaaS), cloud deployment models, and their impact on networking","Cloud computing, cloud service models"
Internet of Things (IoT) and Networking,"IoT devices connect to networks to transmit data. This topic explores IoT technologies, protocols, and the challenges of managing IoT networks","Internet of Things, IoT devices"
Software-Defined Networking (SDN),"SDN separates network control from data forwarding. This topic explains SDN concepts, controllers, and its benefits for network flexibility and management","Software-Defined Networking, network control"
Network Virtualization,"Network virtualization abstracts network resources, enabling multiple virtual networks on a single physical infrastructure. This topic covers virtualization techniques and use cases","Network virtualization, virtual networks"
Network Design and Planning,"Effective network design and planning are essential for scalability and efficiency. This topic discusses network architecture design, capacity planning, and best practices","Network design, capacity planning"
Wireless Security,"Wireless networks are vulnerable to security threats. This topic addresses wireless security measures, encryption protocols, and strategies for protecting wireless communication","Wireless security, encryption"
Network Performance Optimization,"Optimizing network performance is crucial for delivering quality services. This topic covers performance monitoring, tuning, and optimization techniques","Network performance optimization, performance tuning"
Emerging Trends in Networking,"This topic explores the latest trends and innovations in networking, such as 5G, edge computing, and quantum networking, shaping the future of network technology","Emerging trends in networking, technology innovations"
