Bucket Number,Bucket
231,"underlined, key underlined, primary key underlined, underlined primary, underlined primary key, key underlined primary, primary key, primary"
232,"language, datadefinition language, datadefinition, programming language, language language, programming, objectoriented, language differ"
233,"item, data item, database item, item transaction, data item transaction, transaction, transaction data, data item database"
234,"normalization, denormalization, normalized, design, denormalization performance, normalization normalization, normal form normalization, bad database design"
235,"diagram figure, diagram, diagram figure diagram, figure diagram, consider diagram figure, consider diagram, figure diagram figure, figure consider diagram"
236,"phone, phone number, attribute phone, attribute phone number, home phone, home, number, area code"
237,"safe, safety, rule, unsafe, expression, said safe, expression safe, safety expression"
238,"subclass, specialization, subclass specialization, superclass, defined, defined subclass, disjoint, belong subclass"
239,"locking, lock, locking index, granularity, concurrency, index, locking granularity, indexlocking"
240,"student, student enrolled, enrolled, register, retrieve name, name student, count, registration"
241,"columnoriented, storage, columnoriented storage, storage manager, exadata, column based, column based storage, based storage"
242,"web service, service, soap, web, http, webservice, parameter result, http request"
243,"employee tuple, employee, nested query, select employee, select employee tuple, exists, nested, dependent"
244,"operator, operator class, gist, gist operator class, creating operator class, operator symbol, default operator, default operator class"
245,"workflow, task, agent, task agent, scheduler, requirement workflow, processing entity, precondition"
246,"schedule figure, consider schedule, schedule, consider schedule figure, consider partial schedule, partial schedule figure, consider partial, partial schedule"
247,"test, assertion, infinitely, created test validity, test test, costly test assertion, arbitrary predicate costly, assertion created test"
248,"participation, total participation, participate relationship, participate, total, relationship, participation entity, relationship set"
249,"longduration, multilevel transaction, longduration transaction, multilevel, transaction, transaction nested, autonomous transaction, nested multilevel"
250,"log, log record, new value, item log, value updated, update log record, update log, data item"
251,"geometryobject, circle, interface, short, triangle, referencepoint, area, rectangle"
252,"canonical cover, canonical, cover, set functional dependency, set functional, canonical cover set, cover set, dependency"
253,"waitfor, waitfor graph, graph, local waitfor graph, local waitfor, local, edge, waitfor graph figure"
254,"data dictionary, dictionary, catalog, metadata, data data, data dictionary store, dictionary store, data data dictionary"
255,"constructor, structured type, type constructor, structured, type, struct, collection type, construct"
256,"sqlj, java, double, jdbc, sql sqlj, embedded sql, embedded, sqlj java"
257,"example example, illustrate, example illustrate, following example, illustrate use, following example example, illustrate use exists, example"
258,"link, page, anchor text, anchor, web page, hyperlink, text, stanford"
259,"longduration, long transaction, longduration transaction, starvation, long, victim, transaction, transaction progress"
260,"host, copy document, versionvector, versionvector scheme, vdi, copy, document host, scheme"
261,"mean time, failure, mean, mean time failure, time failure, hour, disk, failure disk"
262,"bread, milk, juice, milk bread, cooky, bread juice, bread cooky, percent"
263,"oledb, data source, source, linked server, oledb data, oledb data source, linked, docauthor"
264,"ternary, ternary relationship, binary relationship, relationship, binary, father, degree, mother"
265,"false, true false, true, unknown, false false, true true, false true, false unknown"
266,"architecture, threetier architecture, architecture figure, threetier, application architecture, application architecture evolved, twotier threetier architecture, twotier threetier"
267,"ordered, ordering field, field, record order, file, file ordered record, ordered record, ordering"
268,"audit, trail, audit trail, create audit trail, create audit, security, carried, breach"
269,"notation, notation notation, alternative notation, alternative, notation notation notation, arrow notation, figure alternative notation, notation alternative"
270,"character, escape, pattern, match string, escape character, abcd, pattern matching, string"
271,"extraneous, logically implies, hold, implies, logically implies extraneous, extraneous logically, implies extraneous, logically"
272,"cube, rollup, data cube, cube rollup, rollup operation, rollup construct, cube rollup operation, entire data cube"
273,"join, join parallel, join algorithm, computes join, locally, processor, parallel, parallel join algorithm"
274,"memory, main memory, main, cache, large main, large main memory, memory cache, cache memory"
275,"searchkey, searchkey value, record searchkey value, record searchkey, search key, index entry, nonunique, deleted"
276,"persistent programming, persistent programming language, persistent, programming language, programming, language, language persistent programming, language persistent"
277,"buyer, seller, bid, auction, price, marketplace, multiple seller, multiple buyer"
278,"exception, error, catch, exception handling, error condition, sqlexception, exception condition, handling"
279,"hierarchy, region, country, region country, group region, region country state, hierarchical, country state"
280,"dvd, digital video, digital video disk, video disk, compact disk, disk dvd, video, digital"
281,"relational model, codd, model, relational, paper, paper codd, model chapter, landmark paper"
282,"estimate, size, size estimate, estimated size, size estimation, approximation, accurate, assumption"
283,"query language, language, language sql, widely query language, widely query, study widely query, study widely, query language sql"
284,"create table, table, create table command, create, stand table, table command, table book, command create table"
285,"vector machine, support vector machine, support vector, classifier, learning, vector, training set, learning method"
286,"rose, rational rose, rational, rose data, data modeler, modeler, rose data modeler, rational rose data"
287,"bank database, bank database figure, consider bank, bank, consider bank database, figure consider bank, database figure, database figure consider"
288,"atom, formula, atom formula, relation atom, formula atom, atom following, atom true, atom form"
289,"buffer, buffer management, buffering, operating, buffer replacement, virtualmemory, replacement, management"
290,"bound, formula, tuple variable, free, variable bound, variable, free bound, formula true"
291,"normalization, functional dependency normalization, chapter basic functional, basic functional, normalization relational database, normalization relational, dependency normalization relational, basic functional dependency"
292,"pstmt, instructor, pstmt setint, setint, figure instructor, pstmt setstring, setstring, figure instructor relation"
293,"merge join, mergejoin, merge, mergejoin algorithm, join attribute, sorted, join, hybrid"
294,"tuning, database tuning, workload, tuning process, tune database, guideline database, database tuning assistant, tuning assistant"
295,"termination state, termination, workflow, acceptable termination, acceptable termination state, acceptable, state, scheduler"
296,"selection, selectivity, selection condition, value selection, selection form, complex selection, number distinct value, equality"
297,"instructor, teach, instructor teach, course, taught, select course instructor, query instructor, course instructor"
298,"authorization, authorization specified sql, action control, rolebased authorization, rolebased, authorization specified, authorization access, authorization authorization"
299,"phone, phone number, instructor, instructor entity set, instructor entity, attribute phone, attribute phone number, phone number instructor"
300,"eer, eer model, relational mapping, design eer, database design eer, mapping, eer relational mapping, eer relational"
301,"constraint, constraint constraint, character vin, character vin country, country manufacture, vin country manufacture, vin country, express special form"
302,"sale, reg, qtr, quarter, region, qtr qtr, reg reg, fiscal"
303,"information, knowledge, procedure obtaining information, information giving specific, overabundance, giving specific procedure, specific procedure, obtaining information"
304,"section summarizes, summarizes chapter, section summarizes chapter, summarizes, chapter section summarizes, chapter section, summarizes chapter section, section"
305,"design, good design, design process, bad design, design methodology, bad, quality, reasonable chance"
306,"tree file organization, tree file, file organization, tree, organization, file, use tree, use tree file"
307,"procedure, function procedure, conditional, sql psm, psm, procedure function, statement, statement list"
308,"chapter concurrency control, chapter concurrency, concurrency control, yes yes, concurrency, yes yes yes, false false, yes"
309,"deductive, deductive database, introduction deductive, introduction deductive database, ancestor, father, deductive database system, father ancestor"
310,"merge, run, sorted run, run merged, merge pass, merges, sorted, pass"
311,"query tree, query graph, representation query, relational algebra, represent relational, tree, graph, algebra"
312,"schedule, write operation, read write operation, read write, operation schedule, read, write operation schedule, read write instruction"
313,"query shown figure, query shown, figure relation result, relation result preceding, preceding query shown, shown figure, result preceding query, result preceding"
314,"version, version number, version data, version data item, data item, new version, current version, specified version number"
315,"scheme, scheme advantage, advantage, disadvantage, situation scheme, advantage simple, scheme advantage simple, advantage simple implementation"
316,"block, department block, recently, mru strategy, mru, seek, disk seek, recently block"
317,"physic comp, physic comp finance, finance music, comp finance, comp finance music, physic, history physic comp, history physic"
318,"tsti, wtimestampq, tsti wtimestampq, rtimestampq, tsti rtimestampq, tsti rtimestampq value, rtimestamp, rtimestampq value"
319,"bounding, bounding box, box, box object, bounding box object, rectangle, node bounding box, node bounding"
320,"quote, single quote, string, mark, apostrophe, single, hyphen punctuation mark, punctuation"
321,"loop, fetch, fetch tuple, loop iterate, result set, tuple result, loop iterates, iterates"
322,"selection, disjunctive, conjunctive selection, conjunctive, projection, disjunctive selection, disjunctive condition, selection selection"
323,"reorganization, temporary file, time consuming, time consuming large, consuming large, consuming large file, operation reorganization, temporary file disk"
324,"quadtree, quadtrees, region, division space, division, set point, quad tree, graphically tree"
325,"update statistic, statistic, modification, update, overhead modification database, overhead modification, system update statistic, update statistic automatically"
326,"decisiontree, decisiontree classifier, classifier, decision tree, decision, type classifier, class label, training"
327,"default value, default, null, attribute default, null constraint, attribute default value, specified attribute, specified default"
328,"database programming, approach database programming, approach database, database programming technique, programming, main approach database, programming technique, main approach"
329,"credit, year, tot credit, tot, total credit, avgnum credit, year avgnum, avgnum"
330,"assumption, state assumption, assumption state, state clearly, state, assumption state assumption, state assumption state, clearly"
331,"trigger view, chapter sql complex, view schema modification, query trigger view, trigger view schema, complex query trigger, sql complex query, schema modification"
332,"disk, rate, storage capacity, megabyte, transfer rate, capacity, disk cost, cost"
333,"input, output tuples, input tuples, output, pipelined input, pipelined, tuples, output buffer"
334,"organized follows chapter, chapter organized, chapter organized follows, follows chapter, organized follows, chapter shall, chapter, chapter shall return"
335,"update, temporary update, temporary update problem, update problem, corrected, correction, data database, updating database"
336,"temp, compute temp, temp compute, ship temp, temp compute temp, ship, temp ship temp, temp ship"
337,"collection, raise, void, collection object, bag, dictionary, raise void, object"
338,"relation figure, figure relation figure, figure, figure relation, obtain relation, relation shown figure, relation shown, relation figure relation"
339,"polygon, triangle, point line, triangulated, representation polygon, polyhedron, triangle rectangle, representation"
340,"condition box, condition, selectfromwhere, box, identical essn value, identical essn, statement specifies condition, essn value query"
341,"recursive, recursive view, view relation, view, recursive query, us recursive, view relation instance, us recursive view"
342,"report, reporting, gnu, report generator, generator, reporting service, sql server reporting, server reporting service"
343,"update, view, view update, desired update, productx, mapped update, base relation, underlying base"
344,"single user, multiuser, singleuser, center, multiuser system, multiple user, access database, multiple program"
345,"postgresql, type postgresql, extension type, extension, base type, postgresql type, type, postgresql type postgresql"
346,"supervise, supervise true, supervise supervise, true supervise, supervise true supervise, true supervise true, supervise supervise supervise, supervisor"
347,"finance biology comp, history finance biology, finance biology, history finance, comp history, comp history finance, biology comp, biology comp history"
348,"steal, recovery, force, steal force, steal approach, steal steal, deferred update, undo needed recovery"
349,"set attribute, let set attribute, let set, attribute hold, set attribute hold, hold let, attribute hold let, attribute hold hold"
350,"variation extension, sql variation extension, sql variation, variation, extension, polymorphic, sql feature, type sql variation"
351,"external sortmerge, external, sortmerge, external sorting, sorting, external sortmerge algorithm, sortmerge algorithm, external sorting algorithm"
352,"branch, customer, account number, loan, number branch, customer customer, loan number, account"
353,"development, chapter application, application design development, chapter application design, design development, application design, application development, application"
354,"qbe, qbe qbe, qbe user, query qbe, query query query, filling, query query, specify query"
355,"datastorage, cloud, datastorage system, cloudbased, data storage, system cloud, amazon, architecture datastorage"
356,"cloud, cloud computing, computing, service, computing service, cloud computing service, cloud service, vendor"
357,"basic structure sql, structure sql query, structure sql, basic structure, sql query, struct, basic, comp basic"
358,"income, degree, attribute income, master, categorical, income income, excellent, department name country"
359,"scaleup, speedup, speedup scaleup, sublinear, problem size, said demonstrate, demonstrate, demonstrate sublinear"
360,"discussed section, revisit, later section, section study later, section discussed section, study later section, revisit issue, section"
361,"protocol, protocol protocol, widely typically http, maintain connection protocol, section protocol, subsystem protocol, maintain connection, function performs aspect"
362,"subclass, secretary, engineer, jobtype, entity, secretary engineer, specialization, belong subclass"
363,"diamond, line, relationship, relationship set, representing relationship, straight line, straight, relationship set relationship"
364,"compression, compressed, stored compressed, compress, compressed form, table compression, compression feature, compress block"
365,"semicolon, execute following query, specify execute following, specify execute, multiple sql statement, statement, multiple sql, function query"
366,"attack, xsrf, malicious, xsrf attack, referer, malicious user, web site, called crosssite"
367,"large object, blob, large, locator, character large object, character large, object, clob"
368,"utility, bulk, import, importexport, importexport utility, bulk importexport utility, bulk importexport, load"
369,"data item, item, single data, example data item, data item data, item data, simple model, example data"
370,"tablet, site tablet, master site, master site tablet, site, master, new master site, new master"
371,"query transaction, invocation, expected frequency, analyzing, frequency, expected, analyzing expected, analyzing expected frequency"
372,"thread, clr, sql server, threading, sql server scheduler, server scheduler, server, synchronization"
373,"timestamp, timestamp ordering, ordering, timestamp value, greater timestamp, timestamp greater, timestamp greater timestamp, greater timestamp ordering"
374,"user account, authorization, create schema, schema, authorization identifier, default catalog, account, owner schema"
375,"duplicate, remove duplicate, elimination, duplicate eliminated, eliminated, deduplication, duplicate elimination, answer"
376,"storage indexing, indexing, storage, index storage, index storage indexing, column based storage, column based, based storage"
377,"definition definition, definition definition definition, definition, preliminary definition, definition definition defined, exactly definition definition, exactly definition, definition preliminary definition"
378,"web server, browser, web, html document, server, url, web browser, http"
379,"directory, directory access, directory access protocol, access protocol, data directory, directory information, protocol, organization"
380,"grade, tot cred, cred, tot, take grade, grade null, set tot, set tot cred"
381,"similar operation, operation similar operation, operation, operation operation, operation similar, fundamental operation, fundamental, operation inverse operation"
382,"client, sends result, remote procedure, procedure call, result sent client, call, remote procedure call, result sent"
383,"comp spring, brandt comp, comp, comp spring brandt, spring brandt comp, spring brandt, brandt comp spring, spring"
384,"record relation, relation stored, dictionary note, store record relation, single file, separate file, store relation, file store"
385,"return course, course, return, xcourse, return clause, course identifier, credit, return course identifier"
386,"directory, yahoo, classification hierarchy, document, page section, hierarchy, hierarchical fashion, second problem"
387,"hide, detail, detail database, detail data, implementation detail, implementation detail database, model hide, hiding"
388,"translation, parsing, translation query, translate, compiler, translated, provided automated, query usable form"
389,"record record record, record record, header, file header, file, header file, file header file, record"
390,"ranking, score, scoring factor, result ranked, hit ranking, winner, machinelearning, scoring"
391,"log, log record, type log record, logging, type log, called logical logging, called log, called logical"
392,"transformation, rotation translation scaling, referred cascade, translation scaling, transformation referred, transformation referred cascade, rotation translation, scaling"
393,"expression, expression expression, xcredits, expression example, example expression, consider expression, expression equivalent, initial expression final"
394,"profiler, sql profiler, trace, profile, statement, statement optimized, profiler display, profiler user"
395,"noofemps, function, tablevalued, table function, tablevalued function, noofemps return, function table, elseif noofemps return"
396,"udfs, udts, udf, definition udf, pad work, read write interface, tightly encapsulated, support userdefined data"
397,"logical undo, undo, logical undo operation, undo operation, logical, lowerlevel lock, early lock release, early lock"
398,"assembly, assembly metadata, metadata, manifest, user code implement, contract, user code, code implement"
399,"split attribute, split, best split, information gain, best split attribute, best, attribute split, gain"
400,"legacy, legacy system, switchover, system, system newgeneration, legacy system newgeneration, replacing legacy, newgeneration system"
401,"batch, update, index, index sorting, applying batch, applying batch update, facility data, updating index"
402,"strategy, efficiency, possible strategy accomplish, let verify, known handle, known handle possible, operating running local, local mechanism"
403,"serializability order, timestamp, timestamps, serializability, determine serializability order, determine serializability, timestamp transaction, timestamps transaction determine"
404,"grid, grid array, grid file, dno age, array, dno, age, scale"
405,"zone, time zone, timezone, local time, time time zone, utc, time, timezone information"
406,"fragmentation, allocation, fragmentation replication, data fragmentation, distributed database design, replication, franc, sco"
407,"let, let relation, let let relation, let let, schema let, relation let, let relation let, schema let let"
408,"failure, state existed, existed, database recovery, existed prior, recovery, consistent state, consistent"
409,"indexing hashing, chapter indexing hashing, chapter indexing, indexing, hashing, indexing hashing hash, hashing hash, small chapter indexing"
410,"dbpointer, disk transaction, written disk transaction, disk transaction commits, written disk, transaction commits, new copy, commits"
411,"normal form, normal, form, second normal, second normal form, fourth normal form, fourth normal, form normal"
412,"multiversion, multiversion concurrency control, multiversion concurrency, multiversion scheme, concurrency control, concurrency, serializability, control"
413,"srinivasan, brandt, dept salary, physic, srinivasan physic, katz, einstein said, gold"
414,"collection, related data, collection related data, collection related, database collection related, database collection, collection data, chapter defined database"
415,"overflow, overflow file, record overflow, overflow record, unordered overflow, unordered overflow file, unordered, overflow block"
416,"elec, elec spring, bourikas elec, bourikas, spring, spring kim elec, aoi elec, elec spring kim"
417,"mobile, computer, mobile computing, mobility personal, mobile computer, mobility personal database, computing, mobility"
418,"parity, parity bit, parity block, bit, data parity, bit byte, raid level, protected parity bit"
419,"pnumber, plocation, ssn, sex, hour, pname, ssn ename, ename pnumber pname"
420,"parallelism, processor, parallel, good idea, parallelism case, good idea perform, idea perform operation, available good idea"
421,"purity, measure purity, entropy, purity set, measure, gini, instance single class, measure defined"
422,"salary salary, salary, update instructor set, instructor set salary, update instructor, instructor set, set salary, set salary salary"
423,"socialsecurity, socialsecurity number, social security number, security number, social security, social, person, united state"
424,"protocol ensures, freedom, protocol ensures serializability, serializability deadlock, serializability deadlock freedom, ensures serializability deadlock, ensures serializability, serializability"
425,"prefetch, prefetching, trigger prefetch, prefetch data, asynchronous, data page, scan trigger, scan trigger prefetch"
426,"committed, compensating transaction, compensating, subtransactions, update nested transaction, execution commits action, required compensating transaction, let suppose commits"
427,"slice, dimension block, canada, dimension, dimension block index, block index, region, itemid"
428,"message, message relation, guaranteed delivered, delivered, received message relation, return message, received message, acknowledgment"
429,"dtd, dtd figure, constrain type, constrain, like integer, general second dtd, information present, limitation dtd bibliographical"
430,"null, null value, attribute null, null remaining attribute, null remaining, remaining attribute, arises, omitted"
431,"schedule, schedule set, schedule set transaction, execution sequence, transaction schedule, transaction participates schedule, execution sequence followed, sequence followed"
432,"recursive query, recursive, recursive query processing, transitive closure, approach recursive query, query processing include, recursive sql query, iteration recursive"
433,"thread, process thread, thread process, concurrently, process, multiple thread, execute concurrently, different process thread"
434,"cascade, delete cascade, foreignkey, delete, foreignkey constraint, cascade feature, constraint, foreign key constraint"
435,"insurance, patient, medical, health care, insurance database, health, doctor, consider insurance"
436,"probability, class, instance, probability instance, class probability, training, pdc, bayesian classifier"
437,"true superior true, superior true superior, superior true, true superior, superior, true, strongest authority, superior contains"
