Bucket Number,Bucket
438,"old, new value, old value, item old, value data item, oldvalue, value data, data item old"
439,"psm, sql psm, stored procedure, database stored procedure, procedure, procedure sql psm, stored procedure sql, module"
440,"entity relationship model, relationship model, entity relationship, relationship model chapter, modeling entity relationship, data modeling entity, chapter data modeling, modeling entity"
441,"client, database server, client application, data act, act client, act, server, application"
442,"multitable clustering, multitable, clustering file, multitable clustering file, file organization, clustering, clustering file organization, section cluster"
443,"shankar comp, shankar, spring shankar comp, spring shankar, shankar comp spring, comp spring shankar, fall shankar comp, fall shankar"
444,"course title course, dept music, title course, teach course title, music, course title, dept music instructor, music instructor"
445,"nonvolatile ram, ram, nonvolatile, nvram, nvram buffer, ram buffer, nonvolatile ram buffer, buffer"
446,"city, street, kim, kim kim, street city, live, live city, street city salary"
447,"intentionally left, left blank, page intentionally, page intentionally left, intentionally left blank, intentionally, blank, blank chapter"
448,"quantifier, universal quantifier, universal, existential, existential quantifier, universal quantifier existential, quantifier existential, quantifier existential quantifier"
449,"blocking factor, blocking, factor, bfr, block, number block, calculate blocking, calculate blocking factor"
450,"implementers, cylinder, database storage, large amount, amount, implementers paid attention, distributed different cylinder, distributed different"
451,"point class, point, class, line, lie, plane, classifier, class lie"
452,"question, natural language, question answering, answer question, answering, query natural language, question answering system, query natural"
453,"teacher, student teacher, people, subtables, table people, subtables student, teacher student, student"
454,"buffer block, merge, sorted, sorted output, sorting relation, block transfer, final pas, log block transfer"
455,"relevance, relevance feedback, feedback, document, vector space, document relevance feedback, term, return document"
456,"notation, diagrammatic notation, diagram notation, diagrammatic, diagram, notation diagram, diagrammatic notation displaying, notation displaying"
457,"layer, businesslogic layer, businesslogic, dataaccess layer, dataaccess, layer provides, database businesslogic, model business"
458,"extent, class extent, extent class extent, class, extent class, persistent object, persistent, automatically class"
459,"phantom, phantom phenomenon, phenomenon, phantom conflict, phantom problem, conflict, describes avoid, eliminating phantom"
460,"teach relation, teach relation figure, teach, relation figure, relation teach, relation figure teach, teach relation teach, figure teach"
461,"graph, deadlock, waitfor graph, waitfor, cycle, graph contains cycle, contains cycle, graph contains"
462,"disease, positive, positive case, person disease, predicts, classifier, person actually disease, positive case person"
463,"information tuples, data item corresponding, relation locking, item corresponding relation, information tuples relation, item corresponding, corresponding relation, relation lock"
464,"armstrong, armstrong axiom, axiom, use armstrong, use armstrong axiom, armstrong axiom prove, axiom prove, prove"
465,"level, level expensive, minimum level, design alternative, potential, highest level number, higher level expensive, high level low"
466,"sqlxml, xml query, xml, overview sqlxml, provides overview sqlxml, tripreports, xml output, provides overview"
467,"undone, undo, transaction undone, undo transaction, undo effect, undone transaction, undoing, transaction"
468,"chapter recovery, recovery chapter, recovery, chapter recovery chapter, recovery chapter recovery, disk page, chapter, recovery term"
469,"test case, test, case performs, performs update database, match expected, case performs update, test case performs, mutant"
470,"hillside, account, branch, branch hillside, branch hillside account, hillside account, valleyview, hillside account account"
471,"plsql, procedural, procedural language, oracle plsql, written plsql, plsql java, procedural code, procedural language plsql"
472,"idref, idrefs, attribute type, attribute type idref, type idref, type cdata, idref link, reference element attribute"
473,"survey, excellent survey, present excellent survey, present excellent, excellent, graefe, technique database system, tutorial survey"
474,"capacity, useful capacity, total capacity, storage capacity, terabyte, capacity useful capacity, total capacity useful, capacity useful"
475,"facet, art, art object, museum, artobjects, categorized, epoch, artobjects categorized"
476,"begin transaction end, transaction end transaction, end transaction, begin transaction, transaction end, usually sequence sql, taken action usually, action usually"
477,"closure, compute closure, extraneous, attribute closure, algorithm compute closure, compute closure includes, extraneous compute, compute"
478,"confidence, support confidence, rule, confidence rule, confidence confidence, support, low confidence, lh rh computed"
479,"process, proving, reengineering, process process, fact hold known, process proving certain, process start process, known theorem proving"
480,"visible, created transaction, tuple visible, contains transaction transaction, tuple, contains transaction, visible transaction, second version"
481,"notion, attribute operation, notion key, section define, notion value, notion value variable, instance corresponds, identity interesting relationship"
482,"spring, physic, fall, physic spring, gold physic, einstein physic, null null, physic fall"
483,"bank corporation, city residence, residence employee, residence employee work, city residence employee, corporation, employee work bank, residence"
484,"conflict conflict, conflict, conflict conflict conflict, requirement, requirement application requirement, expect potential, conflict expect, detailed complete"
485,"filtered, filtered index, fulltable, nonclustered index, nonclustered, index filtered, filtered statistic, fulltable index"
486,"storage file structure, chapter storage file, storage file, chapter storage, file structure, record record record, record record, comp chapter storage"
487,"bio summer, summer, bio, biology bio summer, biology bio, null null, biology, spring"
488,"genetic algorithm, genetic, alphabet, algorithm, idea genetic, randomized, idea genetic algorithm, neural network"
489,"figure finance, history music, finance history, finance, history music physic, history, music physic, music"
490,"tickled, partly speedy, progressive fountain annoyingly, speedy dog putrid, dog putrid, speedy dog, fountain, annoyingly tickled partly"
491,"multiversion, timestamp ordering, multiversion timestamp, timestamp, multiversion timestamp ordering, ordering, multiversion protocol, protocol"
492,"inability represent, inability, information inability, information inability represent, repetition information, repetition, represent certain information, inability represent information"
493,"set statement, simplified set, element set, difference, operator, set difference, set, value set"
494,"purchase order, purchase, xml purchase order, xml purchase, xml, order, tag, realistic use"
495,"nonserializable, nonserializable schedule, schedule, nonrecoverable schedule chapter, nonserializable global, nonserializable global schedule, global schedule, nonrecoverable schedule"
496,"piece, pawn, piece pawn, move, percent year, game, percent, pawn move"
497,"web application architecture, web application, application architecture, architecture, web, twolayer web application, threelayer, twolayer web"
498,"program variable, declare section, exec sql, exec, program, variable, sqlcommand, sqlupdatestring"
499,"person, table person, persontype, dateofbirth, dateofbirth date, type persontype, create table person, address address dateofbirth"
500,"atomic object, atomic, object atomic, object state, object, constructor, atomic object state, atom constructor"
501,"binary, binary relationship, binary relationship set, relationship set, relationship, relationship type join, database binary, relationship set binary"
502,"deleted set, value corresponding value, corresponding value, input, value corresponding, input output, value input output, value deleted set"
503,"covert channel, covert, channel, channel covert, covert channel covert, channel allows, channel covert channel, covert channel allows"
504,"issue application development, issue application, tested, testing application migration, application migration, change program, application, testing application"
505,"retrieve name, retrieve name customer, name customer, retrieve, part, supplier, name, customer ordered part"
