Bucket Number,Bucket
-1,"database, data, type, relation, attribute, transaction, department, query"
0,"plan, optimization, cost, optimizer, query, query optimization, estimate, evaluation"
1,"index, secondary index, secondary, search, clustering index, clustering, primary index, field"
2,"partitioning, partition, hash, partitioned, hash join, skew, processor, range partitioning"
3,"bucket, hash, hashing, hash function, bucket address, overflow, hash value, record bucket"
4,"lock, item, data item, request, lock data, lock data item, lock item, locking"
5,"dbms, interface, ibm, application, software, user interface, tool, database"
6,"node, leaf, tree, leaf node, root, entry, pointer, split"
7,"tuples, tuple, number tuples, tuples relation, set tuples, duplicate tuples, tuples tuples, tuple relation"
8,"conceptual, schema, design, conceptual schema, requirement, phase, database design, schema design"
9,"agrawal, srinivasan comp, srinivasan, chakrabarti, silberschatz, chamberlin, jennifer narayan ramesh, franklin wallace jennifer"
10,"join, outer join, outer, natural join, natural, join condition, join operation, condition"
11,"temporal, time, valid, valid time, temporal database, date time, interval, time slot"
12,"spatial, map, geographic, spatial data, geographic data, location, spatial database, road"
13,"aggregate, aggregate function, group, aggregation, count, grouping, function, sum"
14,"calculus, relational calculus, algebra, relational algebra, relational, tuple relational, tuple relational calculus, domain relational calculus"
15,"image, multimedia, video, audio, multimedia database, multimedia source, audio data, clip"
16,"trigger, event, rule, active, action, triggering, active rule, statement level"
17,"schedule, serializable, serializability, serial, serial schedule, conflict, equivalent serial schedule, equivalent serial"
18,"undo, log, log record, undolist, redo, record, undo operation, abort"
19,"encryption, encrypted, public, decryption, key, public key, private key, private"
20,"replication, replica, replicated, subscriber, site, replica data, update, update replica"
21,"materialized, materialized view, view, view maintenance, maintenance, view materialized, index materialized, index materialized view"
22,"bitmap, bitmap index, bit, index, bit bitmap, complement, bitmap value, intersection"
23,"distributed database, distributed, autonomy, federated, heterogeneous, chapter distributed database, chapter distributed, centralized"
24,"bibliographical, bibliographical note, note, reference, note reference, bibliographical note reference, bibliographic, bibliographic note"
25,"deadlock, detection, deadlock detection, prevention, deadlock prevention, deadlock deadlock, wait, waiting"
26,"xml, xml data, xml document, native, document, exchange, native xml, storage xml"
27,"data model, model, object, object database, object oriented, oriented, relational, object relational"
28,"bcnf, decomposition, schema bcnf, relation bcnf, bcnf decomposition, dependency, normal form, normal"
29,"security, label, access control, policy, control, label security, flow, access"
30,"salary, salary instructor, instructor, instructor salary, dept, avg, avg salary, salary salary"
31,"dependency, functional dependency, functional, multivalued dependency, multivalued, dependency functional, dependency functional dependency, set functional"
32,"xsd, xsd element, xml, xml schema, element, type xsd, xsd string, type xsd string"
33,"predicate, datalog, rule, interpretation, prolog, superior, fact, inference mechanism"
34,"privilege, grant, revoke, authorization, granted, account, grant option, grant privilege"
35,"foreign key, foreign, key, primary key, primary, foreignkey, foreignkey constraint, key foreign"
36,"figure, example figure, figure example figure, figure example, example figure example, shown figure, shown, appears figure"
37,"reada, read, readb, writeq, writea, reada writea, readb writeb, writeb"
38,"concurrency, concurrency control, control, control recovery, concurrency control recovery, recovery, concurrency control distributed, control distributed"
39,"transaction processing, processing, transaction, concept transaction, concept, transaction management, transaction processing concept, processing concept"
40,"snapshot, snapshot isolation, isolation, mvcc, postgresql, isolation level, snapshotdata, transaction"
41,"warehouse, data warehouse, data, source, warehouse data, warehouse provide, data warehouse provide, multiple source"
42,"html, javascript, jsp, browser, scripting, code, input, scripting language"
43,"project, employee, employee work, name employee, work project, work, employee work project, retrieve"
44,"popularity, page, pagerank, ranking, link, web page, popularity ranking, spamming"
45,"log, stable storage, stable, log record, output stable, output stable storage, output, logging"
46,"integrity, integrity constraint, constraint, referential integrity, referential, referential integrity constraint, constraint specified, integrity constraint specified"
47,"account, balance, bank, fund, transaction transfer, account balance, transfer, transfer account"
48,"order, sorting, sort, sorted, sort order, order clause, reorder, item"
49,"persistent, persistent object, object, transient, persistent pointer, pointer, object persistent, persistence"
50,"message, messaging, conversation, queue, persistent messaging, persistent, durable, durable queue"
51,"salary, average salary, employee, average, salary employee, salary department, department, employee salary"
52,"subqueries, subquery, nested, nested subqueries, nested query, correlated, nested subquery, outer query"
53,"mining, data mining, pattern, chapter data, data warehousing, warehousing, data warehousing mining, warehousing mining"
54,"advisor, student, instructor student, set advisor, relationship set, relationship set advisor, advisor relationship, instructor"
55,"join order, join, order, access path, join method access, join tree, join method, leftdeep join"
56,"length, byte, fixed length, variablelength, variable length, fixed, length record, length field"
57,"raid, raid level, level, mirroring, disk, raid raid, reliability, redundant"
58,"tape, magnetic, magnetic tape, drive, tape drive, optical, jukebox, optical disk"
59,"weak entity, weak, weak entity set, entity, entity set, weak entity type, identifying, identifying relationship"
60,"twophase locking, twophase, locking, locking protocol, twophase locking protocol, protocol, lock, rigorous"
61,"query tree, transformation, tree, rewrite, query, select operation, rule, transformed"
62,"node, lock, mode, locked, lock node, exclusive, node locked, exclusive mode"
63,"cluster, clustering, distance, clustering algorithm, centroid, radius, birch, cluster record"
64,"precedence, precedence graph, graph, edge, cycle, graph schedule, precedence graph schedule, schedule"
65,"section section, section section section, section, section saw, saw, section section saw, saw section section, section saw section"
66,"atomicity, durability, consistency, property, atomicity durability, transaction atomicity, database consistency, consistent"
67,"employee, department, worksfor, department employee, employee department, employee work, foreign key, foreign"
68,"coordinator, site, ready, new coordinator, message, failed, coordinator fails, ready message"
69,"ontology, semantic, knowledge, concept, knowledge representation, synonym, semantic web, semantic data"
70,"uml, diagram, uml class diagram, uml class, class diagram, uml diagram, notation, modeling"
71,"node, searchkey value, searchkey, pointer, leaf, search key, leaf node, search"
72,"client, client server, tier, architecture, server, client server architecture, server architecture, tier client server"
73,"aborted, abort, transaction aborted, transaction, failure, abort transaction, subtransaction, transaction abort"
74,"union, intersection, union intersection, operation union, set difference, compatible, union compatible, set operation"
75,"parallel, parallel database, parallel database system, architecture, database system, parallel architecture, system, machine"
76,"relation schema, schema, set relation, set relation schema, relation, relational schema, design, schema containing attribute"
77,"flight, seat, reservation, airline, airport, traveler, seat selection, flight number"
78,"domain, atomic, domain attribute, atomic domain, attribute atomic, domain atomic, attribute domain, value domain"
79,"semistructured, unstructured, structured, unstructured data, semistructured data, extraction, information extraction, document"
80,"algorithm, algorithm figure, apply algorithm, algorithm apply, algorithm apply algorithm, compute, pseudocode, algorithm work"
81,"insertion, deletion, insertion deletion, insert, delete, select statement, rejected, delete operation"
82,"composite, multivalued, composite attribute, multivalued attribute, attribute, attribute composite, single valued, derived attribute"
83,"flash, flash memory, flash storage, magnetic disk, magnetic, memory, storage, erase"
84,"book, member, borrowed, librarian, member borrowed, isbn, borrowed book, member borrowed book"
85,"failure, type failure, site, distributed, failure site, continue, failed site, link"
86,"ssn, superssn, sex, ssn bdate address, ssn bdate, salary superssn, bdate address, bdate address sex"
87,"authentication, password, authenticate, user, user password, authentication service, authenticating, authenticating user"
88,"architecture, shareddisk, sharedmemory, sharednothing, sharednothing architecture, processor, shared, shareddisk architecture"
89,"itemsets, frequent, frequent itemsets, itemset, large itemsets, negative border, border, set item"
90,"checkpoint, checkpointing, fuzzy, checkpoint record, transaction checkpoint, fuzzy checkpointing, active transaction, checkpoint checkpoint"
91,"lsn, page, dirtypagetable, log record, dirty page, log, dirty, redo"
92,"view, view definition, create view, query view, view relation, view view, query expression, myview"
93,"student, person, alumnus, graduatestudent, undergraduate, graduate, employee student, set student"
94,"lope, okay aho hardly, okay, lope fan phipps, lope fan, park, hardly, fan phipps yes"
95,"privacy, security, database security, statistical database, statistical, security privacy, data privacy, law"
96,"search, web, agent, social, social search, usage, information, search engine"
97,"throughput, response, response time, number transaction, transaction second, transaction, harmonic mean throughput, mean throughput"
98,"grade, student, gradereport, university, coursenumber, student course, transcript, studentname"
99,"fiber, channel, fiber channel, iscsi, scsi, device, storage, network"
100,"null, null value, unknown, value, value exist, exist, null evaluate, unknown exist"
101,"course, credit, semester, title, offering, credit course, course course, course title"
102,"jdbc, driver, java, jdbc driver, java program, driver manager, jdbc api, oracle jdbc"
103,"memory, shared memory, shared, cache, cache memory, process access, memory manager, memory area"
104,"commit, commit protocol, twophase commit, twophase, protocol, twophase commit protocol, phase commit, phase commit protocol"
105,"delete, update, insert delete, delete update, statement, insert, update statement, update delete"
106,"creditcard, card, credit card, credit, payment, creditcard company, creditcard number, good"
107,"postgresql, mysql, postgres, pgadmin, opensource, tool, administration, stonebraker"
108,"database figure, relational database figure, consider relational database, consider relational, figure consider relational, figure consider, figure, database figure consider"
109,"color, clothes, clothes size, item color, color clothes size, color clothes, skirt, pastel"
110,"bottleneck, tuning, performance, performance tuning, component bottleneck, performance component, utility, improving"
111,"seek, block transfer, transfer, block, number block, buffer, worst case, worst"
112,"head, track, sector, write head, read write head, platter, surface, read write"
113,"availability, partition, network partition, network, site partition, site, site failure, network partitioning"
114,"term, document, relevance, frequency, idf, term document, occurrence, occurrence term"
115,"sql standard, standard, sql, version sql, sql sql, standard sql, version, feature"
116,"lowerlevel entity, lowerlevel entity set, lowerlevel, entity set, higherlevel entity, higherlevel, entity, higherlevel entity set"
117,"subelements, element, child, parent, subelements element, subelement, node, child element"
118,"backup, remote backup, remote, backup site, remote backup site, backup system, remote backup system, site"
119,"inheritance, subtype, multiple inheritance, supertype, supertypes, type hierarchy, subtypes, supertype subtype"
120,"embedded, embedded sql, host language, host, sql, language, programming, sql embedded"
121,"rename, alias, rename operation, renaming, project operation, unary, project, name"
122,"main memory, buffer, main, memory, block, disk block, memory buffer, disk main memory"
123,"sec, course, sec course, entity set section, set section, section entity, course sec, entity set"
124,"diagram, sequence diagram, statechart, use case, statechart diagram, class diagram, collaboration, interaction"
125,"odmg, odmg object, odl, odmg object model, object model, object, object definition, object definition language"
126,"array, php, element, array element, teaching, associative, element array, php array"
127,"relation relation, relation, prereq relation, relation prereq relation, relation practice exercise, relation practice, relation prereq, consider following relation"
128,"cartesian product, cartesian, product, cartesian product operation, product operation, product relation, cartesian product relation, cross"
129,"histogram, range, distribution, example histogram, value range, use histogram, range histogram, estimate"
130,"specialization, generalization, lattice, specialization generalization, hierarchy, hierarchy lattice, subclass, generalization specialization"
131,"deleted record, deleted, record, marker, deletion, record record, space, record deleted"
132,"nestedloop, nestedloop join, join, indexed nestedloop join, indexed nestedloop, block nestedloop, block nestedloop join, indexed"
133,"fragmentation, fragment, vertical, vertical fragmentation, horizontal, vertical fragment, horizontal fragmentation, reconstruct relation"
134,"functional dependency, functional, dependency, functional dependency hold, dependency hold, relation schema, set functional, set functional dependency"
135,"gpa, rank, grade, student, student grade, rank student, order gpa, average"
136,"injection, sql injection, attack, injection attack, attacker, sql injection attack, manipulation attack, sql"
137,"rollback, cascading rollback, cascading, rolled, transaction rollback, transaction, rollback abort, rollback abort transaction"
138,"predicate, predicate true, clause, clause predicate, predicate clause, combination, predicate check clause, comparison predicate"
139,"isolation, isolation level, level, read, serializable, read committed, repeatable read, level isolation"
140,"decomposition, nonadditive, nonadditive join, join property, nonadditive join property, property, relation decomposition, decomposition nonadditive"
141,"timestamps, clock, timestamp, unique, unique timestamps, logical clock, generating unique, counter"
142,"precision, recall, precision recall, recall precision, measure, average precision, relevant, rank position"
143,"servlet, servlets, server, application server, servlets jsp, web server, jsp, glassfish"
144,"approach, problem, technique, described section, section procedure, technique approach, comfortable approach, comfortable"
145,"association, association rule, rule, negative association, mining, college yes, srikant, negative"
146,"certificate, digital, signature, digital signature, public key, digital certificate, public, authority"
147,"xquery, xquery expression, query xquery, xml, xquery language, xquery query, cast, type xquery"
148,"benchmark, tpc, tpc benchmark, performance, tpca, performance benchmark, tpcc, tpcd"
149,"global transaction, local, global, site, transaction access, local transaction, multidatabase, transaction access data"
150,"exercise, exercise exercise, exercise practice, practice exercise, exercise practice exercise, practice, practice exercise practice, exercise exercise exercise"
151,"dimension, fact table, dimension table, fact, table dimension, table, table dimension table, fact table dimension"
152,"block, block map, spanned, rid, rid rid, length record, length, record"
153,"connection, connection pool, pool, connection connection, connection database, database connection, open, opened"
154,"ordering, definition relation, order attribute, order, schema relation, attribute unique schema, unique schema, ordering value tuple"
155,"parallelism, parallelize, parallel, evaluation, interquery, evaluation plan, parallelize operation, relational operation"
156,"failure, lost, crash, loss, storage, nonvolatile, nonvolatile storage, content"
157,"chapter database, chapter database design, database design model, design model, database design, chapter, chapter relational database, chapter relational"
158,"discus, section discus, chapter discus, discus discus, section discus discus, later section discus, later section, chapter discus concept"
159,"entity, entity set, entity entity, entity entity set, attribute entity, set, entity set attribute, set attribute"
160,"pipeline, pipelining, producerdriven, pipelined, demanddriven, producerdriven pipeline, intermediate result disk, result disk"
161,"price, sale, item, purchase, purchase order, sale relation, poid, order"
162,"superkey, superkey set attribute, superkey set, subset superkey, set attribute, attribute superkey, superkey superkey, superkeys"
163,"filegroup, file, filegroups, fileprocessing, directory, operating, file filegroup, placement"
164,"recovery, recovery algorithm, recovery algorithm section, recovery scheme, algorithm section, section recovery, recovery technique, mohan"
165,"multisets, multiset, case, multiset type, array multiset, type added sql, array, added sql"
166,"cardinality, cardinality ratio, ratio, participation, ratio binary relationship, ratio binary, cardinality ratio binary, relationship"
167,"odbc, odbc jdbc, jdbc, jdbc odbc, odbc api, api, server odbc, odbc odbc"
168,"prerequisite, prereq, course prerequisite, course, prerequisite course, new prereq, prereq prereq, course prereq"
169,"processor, parallel, multicore, core, parallel processing, multicore processor, parallel machine, parallelism"
170,"semester, select course, fall, course, spring, ece, select course section, section semester"
171,"primary key, key, candidate key, primary, candidate, key primary, key primary key, key chosen"
172,"administrator, database administrator, administrator database, user, database administrator database, database user, user database, dba"
173,"omit detail, detail, simplicity, omit, following action, following action taken, gray, action taken"
174,"result, result query, result result, cause result, result query result, query result, show result, query show result"
175,"relation attribute, attribute relation, attribute, different relation, name, relation, attribute name, record attribute"
176,"figure figure figure, figure figure, figure, figure appears figure, cylinder figure, figure said, figure figure said, figure figure appears"
177,"mobile, mobile host, host, broadcast, energy, broadcast data, data broadcast, transmitted"
178,"movie, actor, director, producer, movie actor, movie director, preference, actor producer"
179,"xpath, xpath expression, expression, path expression, path, xquery, xpath path expression, xpath path"
180,"cursor, fetch, fetch command, query result, command, fetch orientation, declare cursor, iterator"
181,"form select, query form, query form select, query, query example, following query, select, sample query"
182,"msec, seek time, seek, transfer, transfer time, time, average seek time, millisecond"
183,"instructor teach, instructor, teach, course instructor, taught, course, result instructor, instructor instructor"
184,"physical database design, physical database, physical, database design, design, physical design, factor influence, database design discus"
185,"record type, field, type, data type, number field, type record, type data, field value pair"
186,"session, cookie, session identifier, session object, servlet, identifier, userid, ongoing session"
187,"tablespace, table space, container, tablespaces, space, humanres, extent, table"
188,"crosstab, pivot, total inst, pivot clause, crosstabs, column, inst total inst, total inst total"
189,"equivalence rule, equivalence, expression, subexpression, rule, set equivalence, set equivalence rule, subexpressions"
190,"university, university database, campus, schema university, schema university database, university information, university schema, real university"
191,"instructor, tuples instructor, teach, instructor tuples, tuples, tuple instructor, instructor relation, tuple"
192,"relationship set, set relationship, entity set relationship, relationship, set relationship set, entity set, set, entity"
193,"sql chapter, advanced sql chapter, chapter, chapter advanced sql, advanced sql, chapter advanced, sql chapter advanced, chapter oracle"
194,"ldap, directory, ldap server, attr, entry ldap, ldap data, access protocol, entry"
195,"spatial, spatial join, spatial data, spatial join index, spatial index, join index, index spatial, join index spatial"
196,"delete, insert, delete tuples, delete command, tuples, tuples relation, tuples delete, insert statement"
197,"street, address, city state, composite attribute, attribute street, composite, state zip, city"
198,"comparison, comparison operator, uppercase, operator, case sensitive, lowercase, string, like comparison operator"
199,"superclass, subclass, superclass subclass, subclass relationship, subclass superclass, superclass subclass relationship, member subclass, member"
200,"department, department relation, us attribute, dept, relation department, attribute us, us attribute us, attribute us attribute"
201,"decomposition, lossless, lossless decomposition, decomposition decomposition, decomposition algorithm, decomposition lossless, lossy decomposition, lossy"
202,"aries, aries recovery, recovery, aries recovery algorithm, recovery algorithm, recovery method, stateoftheart, recovery algorithm aries"
203,"shadow, shadow directory, shadow paging, paging, directory, page page, page page page, current directory"
204,"workflow, workflow system, workflow management, example workflow, task, human, automate, organization"
205,"team, player, game, sport, league, pitcher, recorded, played"
206,"tree, tree index, btree index, multilevel index, multilevel, tree tree, btree, index"
207,"shipped, order shipped, commerce, ecommerce, customer, warehouse list, tracking, order"
208,"cascadeless, recoverable, schedule, cascadeless schedule, schedule recoverable, recoverability, strict schedule, strict"
209,"totalsal, salary, employee, salary totalsal, triggered, changing employee, old department, changing"
210,"ddl, datadefinition language, datadefinition, schema, datadefinition language ddl, language ddl, catalog, schema definition"
211,"php, java, scripting, scripting language, language, language java, programming language java, programming"
212,"join take, take, outer join, outer, select student, outer join take, student, natural"
213,"author, book, author array, publisher, array, title, keyword set, pub"
214,"validation, validation phase, phase, validation test, validated, validation phase validation, condition hold, phase start"
215,"output, buffer, modified buffer, buffer block, block, modified, buffer block disk, modified buffer block"
216,"network, localarea network, localarea, widearea, widearea network, area network, wireless, area"
217,"mozart, einstein, gold, califieri, kim, singh, crick, srinivasan"
218,"value element, complex, attribute attribute, attribute, attribute value element, attribute value, complex attribute, attribute left"
219,"keywords, set document, document contain, document, set keywords, document contain specified, contain, contain specified"
220,"transaction second, transaction transaction, transaction type, second transaction, run transaction second, transaction, run transaction, type run"
221,"olap, processing olap, analytical, analytical processing olap, analytical processing, online analytical, online analytical processing, olap server"
222,"view integration, view, integration, view database, view data, multiple view, integration approach, view integration approach"
223,"path expression, path, expression, step path, set node, value path, value path expression, expression return single"
224,"consistency, inconsistency, consistency requirement, level consistency, consistent state, database consistent state, database consistent, ensure change database"
225,"fragment, fragment replicate, replicate, asymmetric, asymmetric fragment, asymmetric fragment replicate, replica fragment, replicated"
226,"oid, encapsulation, object, encapsulation operation, object identity, literal, value oid, literal value"
227,"car, vehicle, accident, license, sport car, woman annual, woman annual income, young woman annual"
228,"tag, end tag, tag specify, text, heading, tag tag, html, slash"
229,"budget, building budget, building, dept building, dept building budget, dept, department, budget department"
230,"instructor, instructor relation, einstein sure, student taught instructor, taught instructor named, einstein sure duplicate, sure duplicate result, id student taught"
